PMID,Title,Authors,Citation,First Author,Journal/Book,Publication Year,Create Date,PMCID,NIHMS ID,DOI
"34755877","IID 2021: towards context-specific protein interaction analyses by increased coverage, enhanced annotation and enrichment analysis","Kotlyar M, Pastrello C, Ahmed Z, Chee J, Varyova Z, Jurisica I.","Nucleic Acids Res. 2022 Jan 7;50(D1):D640-D647. doi: 10.1093/nar/gkab1034.","Kotlyar M","Nucleic Acids Res","2022","2021/11/10","PMC8728267","","10.1093/nar/gkab1034"
"34755868","FusionGDB 2.0: fusion gene annotation updates aided by deep learning","Kim P, Tan H, Liu J, Lee H, Jung H, Kumar H, Zhou X.","Nucleic Acids Res. 2022 Jan 7;50(D1):D1221-D1230. doi: 10.1093/nar/gkab1056.","Kim P","Nucleic Acids Res","2022","2021/11/10","PMC8728198","","10.1093/nar/gkab1056"
"34755538","Drug repurposing against SARS-CoV-1, SARS-CoV-2 and MERS-CoV","Aherfi S, Pradines B, Devaux C, Honore S, Colson P, Scola B, Raoult D.","Future Microbiol. 2021 Nov;16:1341-1370. doi: 10.2217/fmb-2021-0019. Epub 2021 Nov 10.","Aherfi S","Future Microbiol","2021","2021/11/10","PMC8579950","","10.2217/fmb-2021-0019"
"34754622","Functional drug-target-disease network analysis of gene-phenotype connectivity for curcumin in hepatocellular carcinoma","Zhao Y, Tao J, Chen Z, Li S, Liu Z, Lin L, Zhai L.","PeerJ. 2021 Oct 26;9:e12339. doi: 10.7717/peerj.12339. eCollection 2021.","Zhao Y","PeerJ","2021","2021/11/10","PMC8555505","","10.7717/peerj.12339"
"34750571","Integrative analysis of the plasma proteome and polygenic risk of cardiometabolic diseases","Ritchie SC, Lambert SA, Arnold M, Teo SM, Lim S, Scepanovic P, Marten J, Zahid S, Chaffin M, Liu Y, Abraham G, Ouwehand WH, Roberts DJ, Watkins NA, Drew BG, Calkin AC, Di Angelantonio E, Soranzo N, Burgess S, Chapman M, Kathiresan S, Khera AV, Danesh J, Butterworth AS, Inouye M.","Nat Metab. 2021 Nov;3(11):1476-1483. doi: 10.1038/s42255-021-00478-5. Epub 2021 Nov 8.","Ritchie SC","Nat Metab","2021","2021/11/09","PMC8574944","","10.1038/s42255-021-00478-5"
"34748992","Artificial intelligence for the discovery of novel antimicrobial agents for emerging infectious diseases","Bess A, Berglind F, Mukhopadhyay S, Brylinski M, Griggs N, Cho T, Galliano C, Wasan KM.","Drug Discov Today. 2022 Apr;27(4):1099-1107. doi: 10.1016/j.drudis.2021.10.022. Epub 2021 Nov 5.","Bess A","Drug Discov Today","2022","2021/11/08","PMC8570449","","10.1016/j.drudis.2021.10.022"
"34747471","VARIDT 2.0: structural variability of drug transporter","Fu T, Li F, Zhang Y, Yin J, Qiu W, Li X, Liu X, Xin W, Wang C, Yu L, Gao J, Zheng Q, Zeng S, Zhu F.","Nucleic Acids Res. 2022 Jan 7;50(D1):D1417-D1431. doi: 10.1093/nar/gkab1013.","Fu T","Nucleic Acids Res","2022","2021/11/08","PMC8728241","","10.1093/nar/gkab1013"
"34746302","Study on the Mechanism of Liuwei Dihuang Pills in Treating Parkinson's Disease Based on Network Pharmacology","Lin D, Zeng Y, Tang D, Cai Y.","Biomed Res Int. 2021 Oct 28;2021:4490081. doi: 10.1155/2021/4490081. eCollection 2021.","Lin D","Biomed Res Int","2021","2021/11/08","PMC8568527","","10.1155/2021/4490081"
"34745807","Current status of structure-based drug repurposing against COVID-19 by targeting SARS-CoV-2 proteins","Hijikata A, Shionyu C, Nakae S, Shionyu M, Ota M, Kanaya S, Shirai T.","Biophys Physicobiol. 2021 Oct 5;18:226-240. doi: 10.2142/biophysico.bppb-v18.025. eCollection 2021.","Hijikata A","Biophys Physicobiol","2021","2021/11/08","PMC8550875","","10.2142/biophysico.bppb-v18.025"
"34743684","Drug triggered pruritus, rash, papules, and blisters - is AGEP a clash of an altered sphingolipid-metabolism and lysosomotropism of drugs accumulating in the skin?","Blaess M, Kaiser L, Sommerfeld O, Csuk R, Deigner HP.","Lipids Health Dis. 2021 Nov 8;20(1):156. doi: 10.1186/s12944-021-01552-3.","Blaess M","Lipids Health Dis","2021","2021/11/08","PMC8573906","","10.1186/s12944-021-01552-3"
"34739839","RCSB Protein Data Bank resources for structure-facilitated design of mRNA vaccines for existing and emerging viral pathogens","Goodsell DS, Burley SK.","Structure. 2022 Jan 6;30(1):55-68.e2. doi: 10.1016/j.str.2021.10.008. Epub 2021 Nov 4.","Goodsell DS","Structure","2022","2021/11/05","PMC8567414","","10.1016/j.str.2021.10.008"
"34733103","Ligand Docking Methods to Recognize Allosteric Inhibitors for G-Protein-Coupled Receptors","Harini K, Jayashree S, Tiwari V, Vishwanath S, Sowdhamini R.","Bioinform Biol Insights. 2021 Oct 28;15:11779322211037769. doi: 10.1177/11779322211037769. eCollection 2021.","Harini K","Bioinform Biol Insights","2021","2021/11/04","PMC8558589","","10.1177/11779322211037769"
"34730399","Variability in the Responses of Hepatitis B Virus D-Subgenotypes to Antiviral Therapy: Designing Pan-D-Subgenotypic Reverse Transcriptase Inhibitors","Khatun M, Kumar K, Baidya A, Mondal RK, Baszczyňski O, Kalčic F, Banerjee S, Dhali GK, Das K, Chowdhury A, Janeba Z, Chakrabarti S, Datta S.","J Virol. 2022 Jan 26;96(2):e0180021. doi: 10.1128/JVI.01800-21. Epub 2021 Nov 3.","Khatun M","J Virol","2022","2021/11/03","PMC8791253","","10.1128/JVI.01800-21"
"34723158","DCcov: Repositioning of drugs and drug combinations for SARS-CoV-2 infected lung through constraint-based modeling","Kishk A, Pacheco MP, Sauter T.","iScience. 2021 Nov 19;24(11):103331. doi: 10.1016/j.isci.2021.103331. Epub 2021 Oct 23.","Kishk A","iScience","2021","2021/11/01","PMC8536485","","10.1016/j.isci.2021.103331"
"34721386","Drug Repurposing for Atopic Dermatitis by Integration of Gene Networking and Genomic Information","Adikusuma W, Irham LM, Chou WH, Wong HS, Mugiyanto E, Ting J, Perwitasari DA, Chang WP, Chang WC.","Front Immunol. 2021 Oct 13;12:724277. doi: 10.3389/fimmu.2021.724277. eCollection 2021.","Adikusuma W","Front Immunol","2021","2021/11/01","PMC8548825","","10.3389/fimmu.2021.724277"
"34721010","Path4Drug: Data Science Workflow for Identification of Tissue-Specific Biological Pathways Modulated by Toxic Drugs","Füzi B, Gurinova J, Hermjakob H, Ecker GF, Sheriff R.","Front Pharmacol. 2021 Oct 14;12:708296. doi: 10.3389/fphar.2021.708296. eCollection 2021.","Füzi B","Front Pharmacol","2021","2021/11/01","PMC8551608","","10.3389/fphar.2021.708296"
"34718737","The IUPHAR/BPS guide to PHARMACOLOGY in 2022: curating pharmacology for COVID-19, malaria and antibacterials","Harding SD, Armstrong JF, Faccenda E, Southan C, Alexander SPH, Davenport AP, Pawson AJ, Spedding M, Davies JA; NC-IUPHAR.","Nucleic Acids Res. 2022 Jan 7;50(D1):D1282-D1294. doi: 10.1093/nar/gkab1010.","Harding SD","Nucleic Acids Res","2022","2021/10/31","PMC8689838","","10.1093/nar/gkab1010"
"34718726","RNAInter v4.0: RNA interactome repository with redefined confidence scoring system and improved accessibility","Kang J, Tang Q, He J, Li L, Yang N, Yu S, Wang M, Zhang Y, Lin J, Cui T, Hu Y, Tan P, Cheng J, Zheng H, Wang D, Su X, Chen W, Huang Y.","Nucleic Acids Res. 2022 Jan 7;50(D1):D326-D332. doi: 10.1093/nar/gkab997.","Kang J","Nucleic Acids Res","2022","2021/10/31","PMC8728132","","10.1093/nar/gkab997"
"34718717","Therapeutic target database update 2022: facilitating drug discovery with enriched comparative data of targeted agents","Zhou Y, Zhang Y, Lian X, Li F, Wang C, Zhu F, Qiu Y, Chen Y.","Nucleic Acids Res. 2022 Jan 7;50(D1):D1398-D1407. doi: 10.1093/nar/gkab953.","Zhou Y","Nucleic Acids Res","2022","2021/10/31","PMC8728281","","10.1093/nar/gkab953"
"34718689","ARTS-DB: a database for antibiotic resistant targets","Mungan MD, Blin K, Ziemert N.","Nucleic Acids Res. 2022 Jan 7;50(D1):D736-D740. doi: 10.1093/nar/gkab940.","Mungan MD","Nucleic Acids Res","2022","2021/10/31","PMC8728217","","10.1093/nar/gkab940"
"34718207","Knowledge-based approaches to drug discovery for rare diseases","Alves VM, Korn D, Pervitsky V, Thieme A, Capuzzi SJ, Baker N, Chirkova R, Ekins S, Muratov EN, Hickey A, Tropsha A.","Drug Discov Today. 2022 Feb;27(2):490-502. doi: 10.1016/j.drudis.2021.10.014. Epub 2021 Oct 27.","Alves VM","Drug Discov Today","2022","2021/10/31","PMC9124594","NIHMS1804597","10.1016/j.drudis.2021.10.014"
"34709707","Genome-scale metabolic modeling reveals SARS-CoV-2-induced metabolic changes and antiviral targets","Cheng K, Martin-Sancho L, Pal LR, Pu Y, Riva L, Yin X, Sinha S, Nair NU, Chanda SK, Ruppin E.","Mol Syst Biol. 2021 Nov;17(11):e10260. doi: 10.15252/msb.202110260.","Cheng K","Mol Syst Biol","2021","2021/10/28","PMC8552660","","10.15252/msb.202110260"
"34708128","Effects and Components of Herb Pair Huanglian-Banxia on Diabetic Gastroparesis by Network Pharmacology","Liang G, Zhang L, Jiang G, Chen X, Zong Y, Wang F.","Biomed Res Int. 2021 Oct 18;2021:8257937. doi: 10.1155/2021/8257937. eCollection 2021.","Liang G","Biomed Res Int","2021","2021/10/28","PMC8545519","","10.1155/2021/8257937"
"34705247","Screening and Identification of Potential iNOS Inhibitors to Curtail Cervical Cancer Progression: an In Silico Drug Repurposing Approach","Poleboyina PK, Rampogu S, Doneti R, Pasha A, Poleboyina SM, Bhanothu S, Pasumarthi D, S D A, Kumbhakar D, Lee KW, Pawar SC.","Appl Biochem Biotechnol. 2022 Jan;194(1):570-586. doi: 10.1007/s12010-021-03718-2. Epub 2021 Oct 27.","Poleboyina PK","Appl Biochem Biotechnol","2022","2021/10/27","","","10.1007/s12010-021-03718-2"
"34704651","A trans-omic Mendelian randomization study of parental lifespan uncovers novel aging biology and therapeutic candidates for chronic diseases","Perrot N, Pelletier W, Bourgault J, Couture C, Li Z, Mitchell PL, Ghodsian N, Bossé Y, Thériault S, Mathieu P, Arsenault BJ.","Aging Cell. 2021 Nov;20(11):e13497. doi: 10.1111/acel.13497. Epub 2021 Oct 27.","Perrot N","Aging Cell","2021","2021/10/27","PMC8590095","","10.1111/acel.13497"
"34702323","Exploring biological basis of Syndrome differentiation in coronary heart disease patients with two distinct Syndromes by integrated multi-omics and network pharmacology strategy","Wu G, Zhao J, Zhao J, Song N, Zheng N, Zeng Y, Yao T, Zhang J, Weng J, Yuan M, Zhou H, Shen X, Li H, Zhang W.","Chin Med. 2021 Oct 26;16(1):109. doi: 10.1186/s13020-021-00521-3.","Wu G","Chin Med","2021","2021/10/27","PMC8549214","","10.1186/s13020-021-00521-3"
"34697067","Colon Cancer Progression Is Reflected to Monotonic Differentiation in Gene Expression and Pathway Deregulation Facilitating Stage-specific Drug Repurposing","Bourdakou MM, Spyrou GM, Kolios G.","Cancer Genomics Proteomics. 2021 Nov-Dec;18(6):757-769. doi: 10.21873/cgp.20295.","Bourdakou MM","Cancer Genomics Proteomics","2021","2021/10/26","PMC8569813","","10.21873/cgp.20295"
"34693105","WaterMap and Molecular Dynamic Simulation-Guided Discovery of Potential PAK1 Inhibitors Using Repurposing Approaches","Biswal J, Jayaprakash P, Rayala SK, Venkatraman G, Rangaswamy R, Jeyaraman J.","ACS Omega. 2021 Oct 5;6(41):26829-26845. doi: 10.1021/acsomega.1c02032. eCollection 2021 Oct 19.","Biswal J","ACS Omega","2021","2021/10/25","PMC8529594","","10.1021/acsomega.1c02032"
"34691157","Screening Potential Drugs for COVID-19 Based on Bound Nuclear Norm Regularization","Wang J, Wang C, Shen L, Zhou L, Peng L.","Front Genet. 2021 Oct 7;12:749256. doi: 10.3389/fgene.2021.749256. eCollection 2021.","Wang J","Front Genet","2021","2021/10/25","PMC8529063","","10.3389/fgene.2021.749256"
"34685283","Rubber Degrading Strains: Microtetraspora and Dactylosporangium","Basik AA, Nanthini J, Yeo TC, Sudesh K.","Polymers (Basel). 2021 Oct 13;13(20):3524. doi: 10.3390/polym13203524.","Basik AA","Polymers (Basel)","2021","2021/10/23","PMC8538451","","10.3390/polym13203524"
"34681845","Screening of β1- and β2-Adrenergic Receptor Modulators through Advanced Pharmacoinformatics and Machine Learning Approaches","Islam MA, Rallabandi VPS, Mohammed S, Srinivasan S, Natarajan S, Dudekula DB, Park J.","Int J Mol Sci. 2021 Oct 17;22(20):11191. doi: 10.3390/ijms222011191.","Islam MA","Int J Mol Sci","2021","2021/10/23","PMC8538848","","10.3390/ijms222011191"
"34681589","Quantitative Estimate Index for Early-Stage Screening of Compounds Targeting Protein-Protein Interactions","Kosugi T, Ohue M.","Int J Mol Sci. 2021 Oct 10;22(20):10925. doi: 10.3390/ijms222010925.","Kosugi T","Int J Mol Sci","2021","2021/10/23","PMC8539639","","10.3390/ijms222010925"
"34681179","Pharmacology and Adverse Events of Emergency-Use Authorized Medication in Moderate to Severe COVID-19","Hsu JY, Mao YC, Liu PY, Lai KL.","Pharmaceuticals (Basel). 2021 Sep 23;14(10):955. doi: 10.3390/ph14100955.","Hsu JY","Pharmaceuticals (Basel)","2021","2021/10/23","PMC8536968","","10.3390/ph14100955"
"34680307","A Unified Transcriptional, Pharmacogenomic, and Gene Dependency Approach to Decipher the Biology, Diagnostic Markers, and Therapeutic Targets Associated with Prostate Cancer Metastasis","Bacolod MD, Barany F.","Cancers (Basel). 2021 Oct 14;13(20):5158. doi: 10.3390/cancers13205158.","Bacolod MD","Cancers (Basel)","2021","2021/10/23","PMC8534121","","10.3390/cancers13205158"
"34677401","A Systematic Review of Metabolite-to-Drug Ratios of Pharmaceuticals in Hair for Forensic Investigations","Rygaard K, Linnet K, Johansen SS.","Metabolites. 2021 Oct 6;11(10):686. doi: 10.3390/metabo11100686.","Rygaard K","Metabolites","2021","2021/10/22","PMC8539361","","10.3390/metabo11100686"
"34676613","RCSB Protein Data Bank: Celebrating 50 years of the PDB with new tools for understanding and visualizing biological macromolecules in 3D","Burley SK, Bhikadiya C, Bi C, Bittrich S, Chen L, Crichlow GV, Duarte JM, Dutta S, Fayazi M, Feng Z, Flatt JW, Ganesan SJ, Goodsell DS, Ghosh S, Kramer Green R, Guranovic V, Henry J, Hudson BP, Lawson CL, Liang Y, Lowe R, Peisach E, Persikova I, Piehl DW, Rose Y, Sali A, Segura J, Sekharan M, Shao C, Vallat B, Voigt M, Westbrook JD, Whetstone S, Young JY, Zardecki C.","Protein Sci. 2022 Jan;31(1):187-208. doi: 10.1002/pro.4213. Epub 2021 Nov 6.","Burley SK","Protein Sci","2022","2021/10/22","PMC8740825","","10.1002/pro.4213"
"34676340","Delta-9-Tetrahydrocannabinol and Cannabidiol Drug-Drug Interactions","Kocis PT, Vrana KE.","Med Cannabis Cannabinoids. 2020 Jul 7;3(1):61-73. doi: 10.1159/000507998. eCollection 2020 Aug.","Kocis PT","Med Cannabis Cannabinoids","2020","2021/10/22","PMC8489344","","10.1159/000507998"
"34675303","Prediction of severe adverse events, modes of action and drug treatments for COVID-19's complications","Astore C, Zhou H, Jacob J, Skolnick J.","Sci Rep. 2021 Oct 21;11(1):20864. doi: 10.1038/s41598-021-00368-6.","Astore C","Sci Rep","2021","2021/10/22","PMC8531388","","10.1038/s41598-021-00368-6"
"34674631","Context-aware multi-token concept recognition of biological entities","Kim K, Lee D.","BMC Bioinformatics. 2021 Oct 21;22(Suppl 11):337. doi: 10.1186/s12859-021-04248-8.","Kim K","BMC Bioinformatics","2021","2021/10/22","PMC8529713","","10.1186/s12859-021-04248-8"
"34672954","An antibody-based proximity labeling map reveals mechanisms of SARS-CoV-2 inhibition of antiviral immunity","Zhang Y, Shang L, Zhang J, Liu Y, Jin C, Zhao Y, Lei X, Wang W, Xiao X, Zhang X, Liu Y, Liu L, Zhuang MW, Mi Q, Tian C, Wang J, He F, Wang PH, Wang J.","Cell Chem Biol. 2022 Jan 20;29(1):5-18.e6. doi: 10.1016/j.chembiol.2021.10.008. Epub 2021 Oct 20.","Zhang Y","Cell Chem Biol","2022","2021/10/21","PMC8527578","","10.1016/j.chembiol.2021.10.008"
"34671904","Comprehensive Analysis of Key mRNAs and lncRNAs in Osteosarcoma Response to Preoperative Chemotherapy with Prognostic Values","Li M, Cheng WT, Li H, Zhang Z, Lu XL, Deng SS, Li J, Yang CH.","Curr Med Sci. 2021 Oct;41(5):916-929. doi: 10.1007/s11596-021-2430-2. Epub 2021 Oct 20.","Li M","Curr Med Sci","2021","2021/10/21","","","10.1007/s11596-021-2430-2"
"34671863","Recent applications of quantitative systems pharmacology and machine learning models across diseases","Aghamiri SS, Amin R, Helikar T.","J Pharmacokinet Pharmacodyn. 2022 Feb;49(1):19-37. doi: 10.1007/s10928-021-09790-9. Epub 2021 Oct 20.","Aghamiri SS","J Pharmacokinet Pharmacodyn","2022","2021/10/21","PMC8528185","","10.1007/s10928-021-09790-9"
"34671218","The Role of p38γ in Cancer: From review to outlook","Xu W, Liu R, Dai Y, Hong S, Dong H, Wang H.","Int J Biol Sci. 2021 Sep 23;17(14):4036-4046. doi: 10.7150/ijbs.63537. eCollection 2021.","Xu W","Int J Biol Sci","2021","2021/10/21","PMC8495394","","10.7150/ijbs.63537"
"34668739","Network-Based Approaches Reveal Potential Therapeutic Targets for Host-Directed Antileishmanial Therapy Driving Drug Repurposing","Martinez-Hernandez JE, Hammoud Z, de Sousa AM, Kramer F, Monte-Neto RLD, Maracaja-Coutinho V, Martin AJM.","Microbiol Spectr. 2021 Oct 31;9(2):e0101821. doi: 10.1128/Spectrum.01018-21. Epub 2021 Oct 20.","Martinez-Hernandez JE","Microbiol Spectr","2021","2021/10/20","PMC8528132","","10.1128/Spectrum.01018-21"
"34667255","Drug repurposing improves disease targeting 11-fold and can be augmented by network module targeting, applied to COVID-19","Rivero-García I, Castresana-Aguirre M, Guglielmo L, Guala D, Sonnhammer ELL.","Sci Rep. 2021 Oct 19;11(1):20687. doi: 10.1038/s41598-021-99721-y.","Rivero-García I","Sci Rep","2021","2021/10/20","PMC8526804","","10.1038/s41598-021-99721-y"
"34666181","Integrating heterogeneous data to facilitate COVID-19 drug repurposing","Prieto Santamaría L, Díaz Uzquiano M, Ugarte Carro E, Ortiz-Roldán N, Pérez Gallardo Y, Rodríguez-González A.","Drug Discov Today. 2022 Feb;27(2):558-566. doi: 10.1016/j.drudis.2021.10.002. Epub 2021 Oct 16.","Prieto Santamaría L","Drug Discov Today","2022","2021/10/19","PMC8520166","","10.1016/j.drudis.2021.10.002"
"34664659","NPCDR: natural product-based drug combination and its disease-specific molecular regulation","Sun X, Zhang Y, Zhou Y, Lian X, Yan L, Pan T, Jin T, Xie H, Liang Z, Qiu W, Wang J, Li Z, Zhu F, Sui X.","Nucleic Acids Res. 2022 Jan 7;50(D1):D1324-D1333. doi: 10.1093/nar/gkab913.","Sun X","Nucleic Acids Res","2022","2021/10/19","PMC8728151","","10.1093/nar/gkab913"
"34659450","Identification of Novel Biomarkers Related to Lung Squamous Cell Carcinoma Using Integrated Bioinformatics Analysis","Wang H, Huang L, Chen L, Ji J, Zheng Y, Wang Z.","Comput Math Methods Med. 2021 Oct 8;2021:9059116. doi: 10.1155/2021/9059116. eCollection 2021.","Wang H","Comput Math Methods Med","2021","2021/10/18","PMC8519687","","10.1155/2021/9059116"
"34655433","Chemotherapy-Induced Peripheral Neuropathy: Epidemiology, Pathomechanisms and Treatment","Burgess J, Ferdousi M, Gosal D, Boon C, Matsumoto K, Marshall A, Mak T, Marshall A, Frank B, Malik RA, Alam U.","Oncol Ther. 2021 Dec;9(2):385-450. doi: 10.1007/s40487-021-00168-y. Epub 2021 Oct 16.","Burgess J","Oncol Ther","2021","2021/10/16","PMC8593126","","10.1007/s40487-021-00168-y"
"34649566","Investigation of anti-osteoporosis mechanisms of Rehmanniae Radix Preparata based on network pharmacology and experimental verification","Ou L, Kang W, Liang Z, Gao F, Dong T, Wei P, Li M.","J Orthop Surg Res. 2021 Oct 14;16(1):599. doi: 10.1186/s13018-021-02751-5.","Ou L","J Orthop Surg Res","2021","2021/10/15","PMC8515747","","10.1186/s13018-021-02751-5"
"34649499","Quantitative prediction model for affinity of drug-target interactions based on molecular vibrations and overall system of ligand-receptor","Wang XR, Cao TT, Jia CM, Tian XM, Wang Y.","BMC Bioinformatics. 2021 Oct 14;22(1):497. doi: 10.1186/s12859-021-04389-w.","Wang XR","BMC Bioinformatics","2021","2021/10/15","PMC8515642","","10.1186/s12859-021-04389-w"
"34648031","NCATS Inxight Drugs: a comprehensive and curated portal for translational research","Siramshetty VB, Grishagin I, Nguyễn ÐT, Peryea T, Skovpen Y, Stroganov O, Katzel D, Sheils T, Jadhav A, Mathé EA, Southall NT.","Nucleic Acids Res. 2022 Jan 7;50(D1):D1307-D1316. doi: 10.1093/nar/gkab918.","Siramshetty VB","Nucleic Acids Res","2022","2021/10/14","PMC8728186","","10.1093/nar/gkab918"
"34646268","Regulatory Approved Monoclonal Antibodies Contain Framework Mutations Predicted From Human Antibody Repertoires","Petersen BM, Ulmer SA, Rhodes ER, Gutierrez-Gonzalez MF, Dekosky BJ, Sprenger KG, Whitehead TA.","Front Immunol. 2021 Sep 27;12:728694. doi: 10.3389/fimmu.2021.728694. eCollection 2021.","Petersen BM","Front Immunol","2021","2021/10/14","PMC8503325","","10.3389/fimmu.2021.728694"
"34646130","WTD Attenuating Rheumatoid Arthritis via Suppressing Angiogenesis and Modulating the PI3K/AKT/mTOR/HIF-1α Pathway","Ba X, Huang Y, Shen P, Huang Y, Wang H, Han L, Lin WJ, Yan HJ, Xu LJ, Qin K, Chen Z, Tu SH.","Front Pharmacol. 2021 Sep 27;12:696802. doi: 10.3389/fphar.2021.696802. eCollection 2021.","Ba X","Front Pharmacol","2021","2021/10/14","PMC8502817","","10.3389/fphar.2021.696802"
"34637360","Potential interactions between antineoplastic agents and medicines used to treat Covid-19","Sobreira da Silva MJ, Serpa Osorio-de-Castro CG, Paes RD, Negrete CL, Eugênio E, Moraes EL, Livinalli A.","J Oncol Pharm Pract. 2022 Dec;28(8):1737-1748. doi: 10.1177/10781552211040494. Epub 2021 Oct 12.","Sobreira da Silva MJ","J Oncol Pharm Pract","2022","2021/10/12","PMC9619075","","10.1177/10781552211040494"
"34635651","FBXL2 counteracts Grp94 to destabilize EGFR and inhibit EGFR-driven NSCLC growth","Niu M, Xu J, Liu Y, Li Y, He T, Ding L, He Y, Yi Y, Li F, Guo R, Gao Y, Li R, Li L, Fu M, Hu Q, Luo Y, Zhang C, Qin K, Yi J, Yu S, Yang J, Chen H, Wang L, Li Z, Dong B, Qi S, Ouyang L, Zhang Y, Cao Y, Xiao ZJ.","Nat Commun. 2021 Oct 11;12(1):5919. doi: 10.1038/s41467-021-26222-x.","Niu M","Nat Commun","2021","2021/10/12","PMC8505509","","10.1038/s41467-021-26222-x"
"34634800","DDInter: an online drug-drug interaction database towards improving clinical decision-making and patient safety","Xiong G, Yang Z, Yi J, Wang N, Wang L, Zhu H, Wu C, Lu A, Chen X, Liu S, Hou T, Cao D.","Nucleic Acids Res. 2022 Jan 7;50(D1):D1200-D1207. doi: 10.1093/nar/gkab880.","Xiong G","Nucleic Acids Res","2022","2021/10/11","PMC8728114","","10.1093/nar/gkab880"
"34633768","Development of a Novel Pharmacophore Model Guided by the Ensemble of Waters and Small Molecule Fragments Bound to SARS-CoV-2 Main Protease","Kumar P, Mohanty D.","Mol Inform. 2022 Feb;41(2):e2100178. doi: 10.1002/minf.202100178. Epub 2021 Oct 11.","Kumar P","Mol Inform","2022","2021/10/11","PMC8646684","","10.1002/minf.202100178"
"34630336","Targeted Therapy of Papillary Thyroid Cancer: A Comprehensive Genomic Analysis","Hescheler DA, Riemann B, Hartmann MJM, Michel M, Faust M, Bruns CJ, Alakus H, Chiapponi C.","Front Endocrinol (Lausanne). 2021 Sep 24;12:748941. doi: 10.3389/fendo.2021.748941. eCollection 2021.","Hescheler DA","Front Endocrinol (Lausanne)","2021","2021/10/11","PMC8498581","","10.3389/fendo.2021.748941"
"34615900","Activators of alpha synuclein expression identified by reporter cell line-based high throughput drug screen","Stahl F, Denner P, Piston D, Evert BO, de Boni L, Schmitt I, Breuer P, Wüllner U.","Sci Rep. 2021 Oct 6;11(1):19857. doi: 10.1038/s41598-021-98841-9.","Stahl F","Sci Rep","2021","2021/10/07","PMC8494889","","10.1038/s41598-021-98841-9"
"34614039","virusMED: an atlas of hotspots of viral proteins","Zhang H, Chen P, Ma H, Woińska M, Liu D, Cooper DR, Peng G, Peng Y, Deng L, Minor W, Zheng H.","IUCrJ. 2021 Sep 28;8(Pt 6):931-42. doi: 10.1107/S2052252521009076. Online ahead of print.","Zhang H","IUCrJ","2021","2021/10/06","PMC8479994","","10.1107/S2052252521009076"
"34613368","COVID-19 Knowledge Graph from semantic integration of biomedical literature and databases","Chen C, Ross KE, Gavali S, Cowart JE, Wu CH.","Bioinformatics. 2021 Dec 7;37(23):4597-4598. doi: 10.1093/bioinformatics/btab694.","Chen C","Bioinformatics","2021","2021/10/06","PMC8513397","","10.1093/bioinformatics/btab694"
"34611658","Estrogen Hormone Is an Essential Sex Factor Inhibiting Inflammation and Immune Response in COVID-19","Li F, Boon ACM, Michelson AP, Foraker RE, Zhan M, Payne PRO.","Res Sq. 2021 Sep 30:rs.3.rs-936900. doi: 10.21203/rs.3.rs-936900/v1. Preprint.","Li F","Res Sq","2021","2021/10/06","PMC8491851","","10.21203/rs.3.rs-936900/v1"
"34604555","Targeting cathepsins: A potential link between COVID-19 and associated neurological manifestations","Prasad K, Ahamad S, Gupta D, Kumar V.","Heliyon. 2021 Oct;7(10):e08089. doi: 10.1016/j.heliyon.2021.e08089. Epub 2021 Sep 29.","Prasad K","Heliyon","2021","2021/10/04","PMC8479516","","10.1016/j.heliyon.2021.e08089"
"34603472","Exploring the Potential Mechanism of Shennao Fuyuan Tang for Ischemic Stroke Based on Network Pharmacology and Molecular Docking","Li JM, Mu ZN, Zhang TT, Li X, Shang Y, Hu GH.","Evid Based Complement Alternat Med. 2021 Sep 23;2021:6015702. doi: 10.1155/2021/6015702. eCollection 2021.","Li JM","Evid Based Complement Alternat Med","2021","2021/10/04","PMC8486536","","10.1155/2021/6015702"
"34603368","Cross-Disorder Genomics Data Analysis Elucidates a Shared Genetic Basis Between Major Depression and Osteoarthritis Pain","Barowsky S, Jung JY, Nesbit N, Silberstein M, Fava M, Loggia ML, Smoller JW, Lee PH.","Front Genet. 2021 Sep 16;12:687687. doi: 10.3389/fgene.2021.687687. eCollection 2021.","Barowsky S","Front Genet","2021","2021/10/04","PMC8481820","","10.3389/fgene.2021.687687"
"34593915","COVIDrugNet: a network-based web tool to investigate the drugs currently in clinical trial to contrast COVID-19","Menestrina L, Cabrelle C, Recanatini M.","Sci Rep. 2021 Sep 30;11(1):19426. doi: 10.1038/s41598-021-98812-0.","Menestrina L","Sci Rep","2021","2021/10/01","PMC8484553","","10.1038/s41598-021-98812-0"
"34593896","Network pharmacology-based investigation of potential targets of astragalus membranaceous-angelica sinensis compound acting on diabetic nephropathy","Dong Y, Zhao Q, Wang Y.","Sci Rep. 2021 Sep 30;11(1):19496. doi: 10.1038/s41598-021-98925-6.","Dong Y","Sci Rep","2021","2021/10/01","PMC8484574","","10.1038/s41598-021-98925-6"
