PMID,Title,Authors,Citation,First Author,Journal/Book,Publication Year,Create Date,PMCID,NIHMS ID,DOI
"36246574","LIGHTHOUSE illuminates therapeutics for a variety of diseases including COVID-19","Shimizu H, Kodama M, Matsumoto M, Orba Y, Sasaki M, Sato A, Sawa H, Nakayama KI.","iScience. 2022 Oct 10;25(11):105314. doi: 10.1016/j.isci.2022.105314. eCollection 2022 Nov 18.","Shimizu H","iScience","2022","2022/10/17","PMC9549714","","10.1016/j.isci.2022.105314"
"36243975","SPASCER: spatial transcriptomics annotation at single-cell resolution","Fan Z, Luo Y, Lu H, Wang T, Feng Y, Zhao W, Kim P, Zhou X.","Nucleic Acids Res. 2023 Jan 6;51(D1):D1138-D1149. doi: 10.1093/nar/gkac889.","Fan Z","Nucleic Acids Res","2023","2022/10/16","PMC9825565","","10.1093/nar/gkac889"
"36243961","DrugMAP: molecular atlas and pharma-information of all drugs","Li F, Yin J, Lu M, Mou M, Li Z, Zeng Z, Tan Y, Wang S, Chu X, Dai H, Hou T, Zeng S, Chen Y, Zhu F.","Nucleic Acids Res. 2023 Jan 6;51(D1):D1288-D1299. doi: 10.1093/nar/gkac813.","Li F","Nucleic Acids Res","2023","2022/10/16","PMC9825453","","10.1093/nar/gkac813"
"36243960","DRESIS: the first comprehensive landscape of drug resistance information","Sun X, Zhang Y, Li H, Zhou Y, Shi S, Chen Z, He X, Zhang H, Li F, Yin J, Mou M, Wang Y, Qiu Y, Zhu F.","Nucleic Acids Res. 2023 Jan 6;51(D1):D1263-D1275. doi: 10.1093/nar/gkac812.","Sun X","Nucleic Acids Res","2023","2022/10/16","PMC9825618","","10.1093/nar/gkac812"
"36232566","Interpretable Machine Learning Models for Molecular Design of Tyrosine Kinase Inhibitors Using Variational Autoencoders and Perturbation-Based Approach of Chemical Space Exploration","Krishnan K, Kassab R, Agajanian S, Verkhivker G.","Int J Mol Sci. 2022 Sep 24;23(19):11262. doi: 10.3390/ijms231911262.","Krishnan K","Int J Mol Sci","2022","2022/10/14","PMC9569663","","10.3390/ijms231911262"
"36232461","Probing the Potential Mechanism of Quercetin and Kaempferol against Heat Stress-Induced Sertoli Cell Injury: Through Integrating Network Pharmacology and Experimental Validation","Liu DL, Liu SJ, Hu SQ, Chen YC, Guo J.","Int J Mol Sci. 2022 Sep 22;23(19):11163. doi: 10.3390/ijms231911163.","Liu DL","Int J Mol Sci","2022","2022/10/14","PMC9570440","","10.3390/ijms231911163"
"36230722","Exploring Precise Medication Strategies for OSCC Based on Single-Cell Transcriptome Analysis from a Dynamic Perspective","Meng Q, Wu F, Li G, Xu F, Liu L, Zhang D, Lu Y, Xie H, Chen X.","Cancers (Basel). 2022 Sep 30;14(19):4801. doi: 10.3390/cancers14194801.","Meng Q","Cancers (Basel)","2022","2022/10/14","PMC9564072","","10.3390/cancers14194801"
"36230692","Potassium Ion Channels in Malignant Central Nervous System Cancers","Boyle Y, Johns TG, Fletcher EV.","Cancers (Basel). 2022 Sep 29;14(19):4767. doi: 10.3390/cancers14194767.","Boyle Y","Cancers (Basel)","2022","2022/10/14","PMC9563970","","10.3390/cancers14194767"
"36230688","Identification of Immuno-Targeted Combination Therapies Using Explanatory Subgroup Discovery for Cancer Patients with EGFR Wild-Type Gene","Kholod O, Basket W, Liu D, Mitchem J, Kaifi J, Dooley L, Shyu CR.","Cancers (Basel). 2022 Sep 29;14(19):4759. doi: 10.3390/cancers14194759.","Kholod O","Cancers (Basel)","2022","2022/10/14","PMC9564073","","10.3390/cancers14194759"
"36230632","Identification of Monobenzone as a Novel Potential Anti-Acute Myeloid Leukaemia Agent That Inhibits RNR and Suppresses Tumour Growth in Mouse Xenograft Model","Dong J, Zhong T, Xu Z, Chen H, Wang X, Yang L, Lou Z, Xu Y, Hou T, Xu R, Zhu W, Shao J.","Cancers (Basel). 2022 Sep 27;14(19):4710. doi: 10.3390/cancers14194710.","Dong J","Cancers (Basel)","2022","2022/10/14","PMC9564123","","10.3390/cancers14194710"
"36228466","A computational approach to drug repurposing using graph neural networks","Doshi S, Chepuri SP.","Comput Biol Med. 2022 Nov;150:105992. doi: 10.1016/j.compbiomed.2022.105992. Epub 2022 Aug 31.","Doshi S","Comput Biol Med","2022","2022/10/13","PMC9429273","","10.1016/j.compbiomed.2022.105992"
"36225586","Drug repositioning: A bibliometric analysis","Sun G, Dong D, Dong Z, Zhang Q, Fang H, Wang C, Zhang S, Wu S, Dong Y, Wan Y.","Front Pharmacol. 2022 Sep 26;13:974849. doi: 10.3389/fphar.2022.974849. eCollection 2022.","Sun G","Front Pharmacol","2022","2022/10/13","PMC9549161","","10.3389/fphar.2022.974849"
"36225188","Exploring the Potential Mechanism of Qi-Shen-Di-Huang Drug Formulary for Myasthenia Gravis (MG) based on UHPLC-QE-MS Network Pharmacology and Molecular Docking Techniques","Zhang Y, Chang T, Lu Q, Cui Y, Zhang D, Wang B, Xu P, Lu J, Ma J, Lv Z, Wang J.","Evid Based Complement Alternat Med. 2022 Oct 3;2022:7416448. doi: 10.1155/2022/7416448. eCollection 2022.","Zhang Y","Evid Based Complement Alternat Med","2022","2022/10/13","PMC9550457","","10.1155/2022/7416448"
"36223427","Inhibitors of ApiAP2 protein DNA binding exhibit multistage activity against Plasmodium parasites","Russell TJ, De Silva EK, Crowley VM, Shaw-Saliba K, Dube N, Josling G, Pasaje CFA, Kouskoumvekaki I, Panagiotou G, Niles JC, Jacobs-Lorena M, Denise Okafor C, Gamo FJ, Llinás M.","PLoS Pathog. 2022 Oct 12;18(10):e1010887. doi: 10.1371/journal.ppat.1010887. eCollection 2022 Oct.","Russell TJ","PLoS Pathog","2022","2022/10/12","PMC9591056","","10.1371/journal.ppat.1010887"
"36222962","Reactivity and binding mode of disulfiram, its metabolites, and derivatives in SARS-CoV-2 PL(pro): insights from computational chemistry studies","Nogara PA, Omage FB, Bolzan GR, Delgado CP, Orian L, Rocha JBT.","J Mol Model. 2022 Oct 12;28(11):354. doi: 10.1007/s00894-022-05341-2.","Nogara PA","J Mol Model","2022","2022/10/12","PMC9554863","","10.1007/s00894-022-05341-2"
"36216900","DrugRep: an automatic virtual screening server for drug repurposing","Gan JH, Liu JX, Liu Y, Chen SW, Dai WT, Xiao ZX, Cao Y.","Acta Pharmacol Sin. 2023 Apr;44(4):888-896. doi: 10.1038/s41401-022-00996-2. Epub 2022 Oct 10.","Gan JH","Acta Pharmacol Sin","2023","2022/10/10","PMC9549438","","10.1038/s41401-022-00996-2"
"36216820","Old drugs, new tricks: leveraging known compounds to disrupt coronavirus-induced cytokine storm","Richman S, Lyman C, Nesterova A, Yuryev A, Morris M, Cao H, Cheadle C, Skuse G, Broderick G.","NPJ Syst Biol Appl. 2022 Oct 10;8(1):38. doi: 10.1038/s41540-022-00250-9.","Richman S","NPJ Syst Biol Appl","2022","2022/10/10","PMC9549818","","10.1038/s41540-022-00250-9"
"36216799","The spatial transcriptomic landscape of non-small cell lung cancer brain metastasis","Zhang Q, Abdo R, Iosef C, Kaneko T, Cecchini M, Han VK, Li SS.","Nat Commun. 2022 Oct 10;13(1):5983. doi: 10.1038/s41467-022-33365-y.","Zhang Q","Nat Commun","2022","2022/10/10","PMC9551067","","10.1038/s41467-022-33365-y"
"36215042","MiMeDB: the Human Microbial Metabolome Database","Wishart DS, Oler E, Peters H, Guo A, Girod S, Han S, Saha S, Lui VW, LeVatte M, Gautam V, Kaddurah-Daouk R, Karu N.","Nucleic Acids Res. 2023 Jan 6;51(D1):D611-D620. doi: 10.1093/nar/gkac868.","Wishart DS","Nucleic Acids Res","2023","2022/10/10","PMC9825614","","10.1093/nar/gkac868"
"36210804","EFMSDTI: Drug-target interaction prediction based on an efficient fusion of multi-source data","Zhang Y, Wu M, Wang S, Chen W.","Front Pharmacol. 2022 Sep 23;13:1009996. doi: 10.3389/fphar.2022.1009996. eCollection 2022.","Zhang Y","Front Pharmacol","2022","2022/10/10","PMC9538487","","10.3389/fphar.2022.1009996"
"36204231","The Cao-Xiang-Wei-Kang formula attenuates the progression of experimental colitis by restoring the homeostasis of the microbiome and suppressing inflammation","Yu W, Li Q, Shao C, Zhang Y, Kang C, Zheng Y, Liu X, Liu X, Yan J.","Front Pharmacol. 2022 Sep 20;13:946065. doi: 10.3389/fphar.2022.946065. eCollection 2022.","Yu W","Front Pharmacol","2022","2022/10/07","PMC9530714","","10.3389/fphar.2022.946065"
"36204112","Regulation and bioinformatic analysis of circ_0015891/miR-129-1-3p axis in methamphetamine-induced dopaminergic apoptosis","Deng B, Tang X, Wang Y.","Front Endocrinol (Lausanne). 2022 Sep 20;13:999211. doi: 10.3389/fendo.2022.999211. eCollection 2022.","Deng B","Front Endocrinol (Lausanne)","2022","2022/10/07","PMC9530452","","10.3389/fendo.2022.999211"
"36202805","Environmental complexity is more important than mutation in driving the evolution of latent novel traits in E. coli","Karve S, Wagner A.","Nat Commun. 2022 Oct 6;13(1):5904. doi: 10.1038/s41467-022-33634-w.","Karve S","Nat Commun","2022","2022/10/06","PMC9537139","","10.1038/s41467-022-33634-w"
"36200827","ChemPert: mapping between chemical perturbation and transcriptional response for non-cancer cells","Zheng M, Okawa S, Bravo M, Chen F, Martínez-Chantar ML, Del Sol A.","Nucleic Acids Res. 2023 Jan 6;51(D1):D877-D889. doi: 10.1093/nar/gkac862.","Zheng M","Nucleic Acids Res","2023","2022/10/06","PMC9825489","","10.1093/nar/gkac862"
"36200814","CovInter: interaction data between coronavirus RNAs and host proteins","Amahong K, Zhang W, Zhou Y, Zhang S, Yin J, Li F, Xu H, Yan T, Yue Z, Liu Y, Hou T, Qiu Y, Tao L, Han L, Zhu F.","Nucleic Acids Res. 2023 Jan 6;51(D1):D546-D556. doi: 10.1093/nar/gkac834.","Amahong K","Nucleic Acids Res","2023","2022/10/06","PMC9825556","","10.1093/nar/gkac834"
"36199685","One of the active ingredients in Paeoniae Radix Alba functions as JAK1 inhibitor in rheumatoid arthritis","Xiao L, Lin S, Zhan F.","Front Pharmacol. 2022 Sep 19;13:906763. doi: 10.3389/fphar.2022.906763. eCollection 2022.","Xiao L","Front Pharmacol","2022","2022/10/06","PMC9527307","","10.3389/fphar.2022.906763"
"36199085","Recombinant vaccines in 2022: a perspective from the cell factory","de Pinho Favaro MT, Atienza-Garriga J, Martínez-Torró C, Parladé E, Vázquez E, Corchero JL, Ferrer-Miralles N, Villaverde A.","Microb Cell Fact. 2022 Oct 5;21(1):203. doi: 10.1186/s12934-022-01929-8.","de Pinho Favaro MT","Microb Cell Fact","2022","2022/10/05","PMC9532831","","10.1186/s12934-022-01929-8"
"36192741","Exploring the protective mechanism of baicalin in treatment of atherosclerosis using endothelial cells deregulation model and network pharmacology","Li M, Ren C.","BMC Complement Med Ther. 2022 Oct 3;22(1):257. doi: 10.1186/s12906-022-03738-3.","Li M","BMC Complement Med Ther","2022","2022/10/03","PMC9527735","","10.1186/s12906-022-03738-3"
"36192551","Computational systems biology in disease modeling and control, review and perspectives","Yue R, Dutta A.","NPJ Syst Biol Appl. 2022 Oct 3;8(1):37. doi: 10.1038/s41540-022-00247-4.","Yue R","NPJ Syst Biol Appl","2022","2022/10/03","PMC9528884","","10.1038/s41540-022-00247-4"
"36187298","Effectiveness of Remdesivir in Comparison with Five Approved Antiviral Drugs for Inhibition of RdRp in Combat with SARS-CoV-2","Mahdian S, Arab SS.","Iran J Sci Technol Trans A Sci. 2022;46(5):1359-1367. doi: 10.1007/s40995-022-01364-9. Epub 2022 Sep 24.","Mahdian S","Iran J Sci Technol Trans A Sci","2022","2022/10/03","PMC9510211","","10.1007/s40995-022-01364-9"
"36180795","Stroke genetics informs drug discovery and risk prediction across ancestries","Mishra A, Malik R, Hachiya T, Jürgenson T, Namba S, Posner DC, Kamanu FK, Koido M, Le Grand Q, Shi M, He Y, Georgakis MK, Caro I, Krebs K, Liaw YC, Vaura FC, Lin K, Winsvold BS, Srinivasasainagendra V, Parodi L, Bae HJ, Chauhan G, Chong MR, Tomppo L, Akinyemi R, Roshchupkin GV, Habib N, Jee YH, Thomassen JQ, Abedi V, Cárcel-Márquez J, Nygaard M, Leonard HL, Yang C, Yonova-Doing E, Knol MJ, Lewis AJ, Judy RL, Ago T, Amouyel P, Armstrong ND, Bakker MK, Bartz TM, Bennett DA, Bis JC, Bordes C, Børte S, Cain A, Ridker PM, Cho K, Chen Z, Cruchaga C, Cole JW, de Jager PL, de Cid R, Endres M, Ferreira LE, Geerlings MI, Gasca NC, Gudnason V, Hata J, He J, Heath AK, Ho YL, Havulinna AS, Hopewell JC, Hyacinth HI, Inouye M, Jacob MA, Jeon CE, Jern C, Kamouchi M, Keene KL, Kitazono T, Kittner SJ, Konuma T, Kumar A, Lacaze P, Launer LJ, Lee KJ, Lepik K, Li J, Li L, Manichaikul A, Markus HS, Marston NA, Meitinger T, Mitchell BD, Montellano FA, Morisaki T, Mosley TH, Nalls MA, Nordestgaard BG, O'Donnell MJ, Okada Y, Onland-Moret NC, Ovbiagele B, Peters A, Psaty BM, Rich SS, et al.","Nature. 2022 Nov;611(7934):115-123. doi: 10.1038/s41586-022-05165-3. Epub 2022 Sep 30.","Mishra A","Nature","2022","2022/09/30","PMC9524349","","10.1038/s41586-022-05165-3"
"36178627","Specifics of Metabolite-Protein Interactions and Their Computational Analysis and Prediction","Walther D.","Methods Mol Biol. 2023;2554:179-197. doi: 10.1007/978-1-0716-2624-5_12.","Walther D","Methods Mol Biol","2023","2022/09/30","","","10.1007/978-1-0716-2624-5_12"
"36175827","Small molecule modulation of microbiota: a systems pharmacology perspective","Liu Q, Lee B, Xie L.","BMC Bioinformatics. 2022 Sep 29;23(Suppl 3):403. doi: 10.1186/s12859-022-04941-2.","Liu Q","BMC Bioinformatics","2022","2022/09/29","PMC9523894","","10.1186/s12859-022-04941-2"
"36173247","Discovery of druggable cancer-specific pathways with application in acute myeloid leukemia","Trac QT, Zhou T, Pawitan Y, Vu TN.","Gigascience. 2022 Sep 29;11:giac091. doi: 10.1093/gigascience/giac091.","Trac QT","Gigascience","2022","2022/09/29","PMC9520771","","10.1093/gigascience/giac091"
"36172200","Anti-asthmatic fraction screening and mechanisms prediction of Schisandrae Sphenantherae Fructus based on a combined approach","Li F, Li B, Liu J, Wei X, Qiang T, Mu X, Wang Y, Qi Y, Zhang B, Liu H, Xiao P.","Front Pharmacol. 2022 Sep 12;13:902324. doi: 10.3389/fphar.2022.902324. eCollection 2022.","Li F","Front Pharmacol","2022","2022/09/29","PMC9511055","","10.3389/fphar.2022.902324"
"36172193","Drug repurposing candidates to treat core symptoms in autism spectrum disorder","Koch E, Demontis D.","Front Pharmacol. 2022 Sep 12;13:995439. doi: 10.3389/fphar.2022.995439. eCollection 2022.","Koch E","Front Pharmacol","2022","2022/09/29","PMC9510394","","10.3389/fphar.2022.995439"
"36171417","Drug genetic associations with COVID-19 manifestations: a data mining and network biology approach","Charitou T, Kontou PI, Tamposis IA, Pavlopoulos GA, Braliou GG, Bagos PG.","Pharmacogenomics J. 2022 Dec;22(5-6):294-302. doi: 10.1038/s41397-022-00289-1. Epub 2022 Sep 28.","Charitou T","Pharmacogenomics J","2022","2022/09/28","PMC9517961","","10.1038/s41397-022-00289-1"
"36171337","A message passing framework with multiple data integration for miRNA-disease association prediction","Dong TN, Schrader J, Mücke S, Khosla M.","Sci Rep. 2022 Sep 28;12(1):16259. doi: 10.1038/s41598-022-20529-5.","Dong TN","Sci Rep","2022","2022/09/28","PMC9519928","","10.1038/s41598-022-20529-5"
"36169867","Computational Chemistry and Molecular Modeling of Reversible MAO Inhibitors","Yelekçi K, Erdem SS.","Methods Mol Biol. 2023;2558:221-252. doi: 10.1007/978-1-0716-2643-6_17.","Yelekçi K","Methods Mol Biol","2023","2022/09/28","","","10.1007/978-1-0716-2643-6_17"
"36165955","qPTM: an updated database for PTM dynamics in human, mouse, rat and yeast","Yu K, Wang Y, Zheng Y, Liu Z, Zhang Q, Wang S, Zhao Q, Zhang X, Li X, Xu RH, Liu ZX.","Nucleic Acids Res. 2023 Jan 6;51(D1):D479-D487. doi: 10.1093/nar/gkac820.","Yu K","Nucleic Acids Res","2023","2022/09/27","PMC9825568","","10.1093/nar/gkac820"
"36161321","Cell Taxonomy: a curated repository of cell types with multifaceted characterization","Jiang S, Qian Q, Zhu T, Zong W, Shang Y, Jin T, Zhang Y, Chen M, Wu Z, Chu Y, Zhang R, Luo S, Jing W, Zou D, Bao Y, Xiao J, Zhang Z.","Nucleic Acids Res. 2023 Jan 6;51(D1):D853-D860. doi: 10.1093/nar/gkac816.","Jiang S","Nucleic Acids Res","2023","2022/09/26","PMC9825571","","10.1093/nar/gkac816"
"36160115","Potential Biomarkers and Signaling Pathways Associated with the Pathogenesis of Primary Ameloblastoma: A Systems Biology Approach","Bayat Z, Mirzaeian A, Taherkhani A.","Int J Dent. 2022 Sep 16;2022:3316313. doi: 10.1155/2022/3316313. eCollection 2022.","Bayat Z","Int J Dent","2022","2022/09/26","PMC9507750","","10.1155/2022/3316313"
"36158581","TurboPutative: A web server for data handling and metabolite classification in untargeted metabolomics","Barrero-Rodríguez R, Rodriguez JM, Tarifa R, Vázquez J, Mastrangelo A, Ferrarini A.","Front Mol Biosci. 2022 Sep 8;9:952149. doi: 10.3389/fmolb.2022.952149. eCollection 2022.","Barrero-Rodríguez R","Front Mol Biosci","2022","2022/09/26","PMC9493301","","10.3389/fmolb.2022.952149"
"36153346","Identification of potential modulators of IFITM3 by in-silico modeling and virtual screening","Tiwari V, Viswanath S.","Sci Rep. 2022 Sep 24;12(1):15952. doi: 10.1038/s41598-022-20259-8.","Tiwari V","Sci Rep","2022","2022/09/24","PMC9509314","","10.1038/s41598-022-20259-8"
"36151774","Efficacy difference of antipsychotics in Alzheimer's disease and schizophrenia: explained with network efficiency and pathway analysis methods","Fan P, Kofler J, Ding Y, Marks M, Sweet RA, Wang L.","Brief Bioinform. 2022 Nov 19;23(6):bbac394. doi: 10.1093/bib/bbac394.","Fan P","Brief Bioinform","2022","2022/09/24","PMC9677501","","10.1093/bib/bbac394"
"36149789","In-depth proteomic analysis reveals unique subtype-specific signatures in human small-cell lung cancer","Szeitz B, Megyesfalvi Z, Woldmar N, Valkó Z, Schwendenwein A, Bárány N, Paku S, László V, Kiss H, Bugyik E, Lang C, Szász AM, Pizzatti L, Bogos K, Hoda MA, Hoetzenecker K, Marko-Varga G, Horvatovich P, Döme B, Schelch K, Rezeli M.","Clin Transl Med. 2022 Sep;12(9):e1060. doi: 10.1002/ctm2.1060.","Szeitz B","Clin Transl Med","2022","2022/09/23","PMC9506422","","10.1002/ctm2.1060"
"36147662","The potential of a data centred approach & knowledge graph data representation in chemical safety and drug design","Pavel A, Saarimäki LA, Möbus L, Federico A, Serra A, Greco D.","Comput Struct Biotechnol J. 2022 Sep 5;20:4837-4849. doi: 10.1016/j.csbj.2022.08.061. eCollection 2022.","Pavel A","Comput Struct Biotechnol J","2022","2022/09/23","PMC9464643","","10.1016/j.csbj.2022.08.061"
"36145543","Development and Evaluation of a Physiologically Based Pharmacokinetic Model for Predicting Haloperidol Exposure in Healthy and Disease Populations","Alasmari MS, Alasmari F, Alasmari AF, Alshamsan A, Alsanea S, Rasool MF, Alqahtani F.","Pharmaceutics. 2022 Aug 26;14(9):1795. doi: 10.3390/pharmaceutics14091795.","Alasmari MS","Pharmaceutics","2022","2022/09/23","PMC9506126","","10.3390/pharmaceutics14091795"
"36145511","Revisiting Cerebrospinal Fluid Flow Direction and Rate in Physiologically Based Pharmacokinetic Model","Hirasawa M, de Lange ECM.","Pharmaceutics. 2022 Aug 24;14(9):1764. doi: 10.3390/pharmaceutics14091764.","Hirasawa M","Pharmaceutics","2022","2022/09/23","PMC9504371","","10.3390/pharmaceutics14091764"
"36145362","In Silico Prediction of Anti-Infective and Cell-Penetrating Peptides from Thalassophryne nattereri Natterin Toxins","De Cena GL, Scavassa BV, Conceição K.","Pharmaceuticals (Basel). 2022 Sep 13;15(9):1141. doi: 10.3390/ph15091141.","De Cena GL","Pharmaceuticals (Basel)","2022","2022/09/23","PMC9501638","","10.3390/ph15091141"
"36144587","Alkaloidal Phytoconstituents for Diabetes Management: Exploring the Unrevealed Potential","Behl T, Gupta A, Albratty M, Najmi A, Meraya AM, Alhazmi HA, Anwer MK, Bhatia S, Bungau SG.","Molecules. 2022 Sep 9;27(18):5851. doi: 10.3390/molecules27185851.","Behl T","Molecules","2022","2022/09/23","PMC9501853","","10.3390/molecules27185851"
"36141135","Detecting the Critical States of Type 2 Diabetes Mellitus Based on Degree Matrix Network Entropy by Cross-Tissue Analysis","Yang Y, Tian Z, Song M, Ma C, Ge Z, Li P.","Entropy (Basel). 2022 Sep 5;24(9):1249. doi: 10.3390/e24091249.","Yang Y","Entropy (Basel)","2022","2022/09/23","PMC9498060","","10.3390/e24091249"
"36139342","Effects of Sulfamethoxazole on Fertilization and Embryo Development in the Arbacia lixula Sea Urchin","Lazzara V, Mauro M, Celi M, Cammilleri G, Vizzini A, Luparello C, Bellini P, Ferrantelli V, Vazzana M.","Animals (Basel). 2022 Sep 19;12(18):2483. doi: 10.3390/ani12182483.","Lazzara V","Animals (Basel)","2022","2022/09/23","PMC9495157","","10.3390/ani12182483"
"36134713","M6AREG: m6A-centered regulation of disease development and drug response","Liu S, Chen L, Zhang Y, Zhou Y, He Y, Chen Z, Qi S, Zhu J, Chen X, Zhang H, Luo Y, Qiu Y, Tao L, Zhu F.","Nucleic Acids Res. 2023 Jan 6;51(D1):D1333-D1344. doi: 10.1093/nar/gkac801.","Liu S","Nucleic Acids Res","2023","2022/09/22","PMC9825441","","10.1093/nar/gkac801"
"36134028","A p53 transcriptional signature in primary and metastatic cancers derived using machine learning","Keshavarz-Rahaghi F, Pleasance E, Kolisnik T, Jones SJM.","Front Genet. 2022 Aug 29;13:987238. doi: 10.3389/fgene.2022.987238. eCollection 2022.","Keshavarz-Rahaghi F","Front Genet","2022","2022/09/22","PMC9483853","","10.3389/fgene.2022.987238"
"36124784","DrDimont: explainable drug response prediction from differential analysis of multi-omics networks","Hiort P, Hugo J, Zeinert J, Müller N, Kashyap S, Rajapakse JC, Azuaje F, Renard BY, Baum K.","Bioinformatics. 2022 Sep 16;38(Suppl_2):ii113-ii119. doi: 10.1093/bioinformatics/btac477.","Hiort P","Bioinformatics","2022","2022/09/20","PMC9486584","","10.1093/bioinformatics/btac477"
"36124309","Knowledge-guided deep learning models of drug toxicity improve interpretation","Hao Y, Romano JD, Moore JH.","Patterns (N Y). 2022 Aug 24;3(9):100565. doi: 10.1016/j.patter.2022.100565. eCollection 2022 Sep 9.","Hao Y","Patterns (N Y)","2022","2022/09/20","PMC9481960","","10.1016/j.patter.2022.100565"
"36120365","DPHB, a diarylheptane from Alpinia officinarum Hance, ameliorates insulin resistance: A network pharmacology and in vitro study","Li X, Wen H, Zhang Y, Liu A, Zhang X, Fu M, Pan Y, Xu J, Zhang J.","Front Pharmacol. 2022 Sep 1;13:956812. doi: 10.3389/fphar.2022.956812. eCollection 2022.","Li X","Front Pharmacol","2022","2022/09/19","PMC9475175","","10.3389/fphar.2022.956812"
"36118934","Investigating pharmacological mechanisms of andrographolide on non-alcoholic steatohepatitis (NASH): A bioinformatics approach of network pharmacology","Li L, Li SH, Jiang JP, Liu C, Ji LL.","Chin Herb Med. 2021 May 13;13(3):342-350. doi: 10.1016/j.chmed.2021.05.001. eCollection 2021 Jul.","Li L","Chin Herb Med","2021","2022/09/19","PMC9476713","","10.1016/j.chmed.2021.05.001"
"36118173","Consensus docking and MM-PBSA computations identify putative furin protease inhibitors for developing potential therapeutics against COVID-19","Dankwa B, Broni E, Enninful KS, Kwofie SK, Wilson MD.","Struct Chem. 2022;33(6):2221-2241. doi: 10.1007/s11224-022-02056-1. Epub 2022 Sep 14.","Dankwa B","Struct Chem","2022","2022/09/19","PMC9470509","","10.1007/s11224-022-02056-1"
"36118098","Investigation of Anti-Liver Cancer Activity of the Herbal Drug FDY003 Using Network Pharmacology","Lee HS, Lee IH, Park SI, Jung M, Yang SG, Kwon TW, Lee DY.","Evid Based Complement Alternat Med. 2022 Sep 9;2022:5765233. doi: 10.1155/2022/5765233. eCollection 2022.","Lee HS","Evid Based Complement Alternat Med","2022","2022/09/19","PMC9481369","","10.1155/2022/5765233"
"36118001","Assessment of pulmonary infectious disease treatment with Mongolian medicine formulae based on data mining, network pharmacology and molecular docking","Zhou B, Qian Z, Li Q, Gao Y, Li M.","Chin Herb Med. 2022 Jul 22;14(3):432-448. doi: 10.1016/j.chmed.2022.07.001. eCollection 2022 Jul.","Zhou B","Chin Herb Med","2022","2022/09/19","PMC9476772","","10.1016/j.chmed.2022.07.001"
"36114278","Prediction of drug-drug interaction events using graph neural networks based feature extraction","Al-Rabeah MH, Lakizadeh A.","Sci Rep. 2022 Sep 16;12(1):15590. doi: 10.1038/s41598-022-19999-4.","Al-Rabeah MH","Sci Rep","2022","2022/09/16","PMC9481536","","10.1038/s41598-022-19999-4"
"36106095","In silico studies of M(pro) and PL(pro) from SARS-CoV-2 and a new class of cephalosporin drugs containing 1,2,4-thiadiazole","Delgado CP, Rocha JBT, Orian L, Bortoli M, Nogara PA.","Struct Chem. 2022;33(6):2205-2220. doi: 10.1007/s11224-022-02036-5. Epub 2022 Sep 10.","Delgado CP","Struct Chem","2022","2022/09/15","PMC9463509","","10.1007/s11224-022-02036-5"
"36105612","Integration of genomic variants and bioinformatic-based approach to drive drug repurposing for multiple sclerosis","Afief AR, Irham LM, Adikusuma W, Perwitasari DA, Brahmadhi A, Cheung R.","Biochem Biophys Rep. 2022 Sep 5;32:101337. doi: 10.1016/j.bbrep.2022.101337. eCollection 2022 Dec.","Afief AR","Biochem Biophys Rep","2022","2022/09/15","PMC9464879","","10.1016/j.bbrep.2022.101337"
"36105485","Identification of Warning Transition Points from Hepatitis B to Hepatocellular Carcinoma Based on Mutation Accumulation for the Early Diagnosis and Potential Drug Treatment of HBV-HCC","Xu F, Meng Q, Wu F, Wang Y, Yang W, Tong Y, Liu L, Chen X.","Oxid Med Cell Longev. 2022 Sep 5;2022:3472179. doi: 10.1155/2022/3472179. eCollection 2022.","Xu F","Oxid Med Cell Longev","2022","2022/09/15","PMC9467738","","10.1155/2022/3472179"
"36100897","GCMM: graph convolution network based on multimodal attention mechanism for drug repurposing","Zhang F, Hu W, Liu Y.","BMC Bioinformatics. 2022 Sep 13;23(1):372. doi: 10.1186/s12859-022-04911-8.","Zhang F","BMC Bioinformatics","2022","2022/09/13","PMC9469552","","10.1186/s12859-022-04911-8"
"36097005","Association between urate-lowering therapies and cognitive decline in community-dwelling older adults","Molet-Benhamou L, Giudici KV, de Souto Barreto P, Cantet C, Rolland Y; MAPT/DSA group.","Sci Rep. 2022 Sep 12;12(1):15299. doi: 10.1038/s41598-022-17808-6.","Molet-Benhamou L","Sci Rep","2022","2022/09/12","PMC9467991","","10.1038/s41598-022-17808-6"
"36091949","Multi-omics analysis to screen potential therapeutic biomarkers for anti-cancer compounds","Li R, Zhou W.","Heliyon. 2022 Jul 13;8(9):e09616. doi: 10.1016/j.heliyon.2022.e09616. eCollection 2022 Sep.","Li R","Heliyon","2022","2022/09/12","PMC9450078","","10.1016/j.heliyon.2022.e09616"
