PMID,Title,Authors,Citation,First Author,Journal/Book,Publication Year,Create Date,PMCID,NIHMS ID,DOI
"33240477","Drug-induced liver injury after switching from tamoxifen to anastrozole in a patient with a history of breast cancer being treated for hypertension and diabetes","Potmešil P, Szotkowská R.","Ther Adv Chronic Dis. 2020 Nov 16;11:2040622320964152. doi: 10.1177/2040622320964152. eCollection 2020.","Potmešil P","Ther Adv Chronic Dis","2020","2020/11/26","PMC7675855","","10.1177/2040622320964152"
"33237278","Integration of the Drug-Gene Interaction Database (DGIdb 4.0) with open crowdsource efforts","Freshour SL, Kiwala S, Cotto KC, Coffman AC, McMichael JF, Song JJ, Griffith M, Griffith OL, Wagner AH.","Nucleic Acids Res. 2021 Jan 8;49(D1):D1144-D1151. doi: 10.1093/nar/gkaa1084.","Freshour SL","Nucleic Acids Res","2021","2020/11/25","PMC7778926","","10.1093/nar/gkaa1084"
"33235614","Anti-inflammatory activity of Radix Angelicae biseratae in the treatment of osteoarthritis determined by systematic pharmacology and in vitro experiments","Chen Z, Zheng R, Chen J, Fu C, Lin J, Wu G.","Exp Ther Med. 2021 Jan;21(1):5. doi: 10.3892/etm.2020.9437. Epub 2020 Nov 2.","Chen Z","Exp Ther Med","2021","2020/11/25","PMC7678626","","10.3892/etm.2020.9437"
"33234725","Exploring the mechanism of resistance to sorafenib in two hepatocellular carcinoma cell lines","Zhang Z, He CZ, Qin YQ, Liao JJ, Huang ST, Mo S, Li HM, Lin JY.","Aging (Albany NY). 2020 Nov 21;12(23):24255-24269. doi: 10.18632/aging.104195. Epub 2020 Nov 21.","Zhang Z","Aging (Albany NY)","2020","2020/11/25","PMC7762478","","10.18632/aging.104195"
"33234678","Inhibiting the reproduction of SARS-CoV-2 through perturbations in human lung cell metabolic network","Delattre H, Sasidharan K, Soyer OS.","Life Sci Alliance. 2020 Nov 24;4(1):e202000869. doi: 10.26508/lsa.202000869. Print 2021 Jan.","Delattre H","Life Sci Alliance","2020","2020/11/25","PMC7723300","","10.26508/lsa.202000869"
"33231570","KIAA0101 as a new diagnostic and prognostic marker, and its correlation with gene regulatory networks and immune infiltrates in lung adenocarcinoma","Hu S, Zeng W, Zhang W, Xu J, Yu D, Peng J, Wei Y.","Aging (Albany NY). 2020 Nov 20;13(1):301-339. doi: 10.18632/aging.104144. Epub 2020 Nov 20.","Hu S","Aging (Albany NY)","2020","2020/11/24","PMC7835026","","10.18632/aging.104144"
"33218024","Target-Centered Drug Repurposing Predictions of Human Angiotensin-Converting Enzyme 2 (ACE2) and Transmembrane Protease Serine Subtype 2 (TMPRSS2) Interacting Approved Drugs for Coronavirus Disease 2019 (COVID-19) Treatment through a Drug-Target Interaction Deep Learning Model","Choi Y, Shin B, Kang K, Park S, Beck BR.","Viruses. 2020 Nov 18;12(11):1325. doi: 10.3390/v12111325.","Choi Y","Viruses","2020","2020/11/21","PMC7698791","","10.3390/v12111325"
"33214616","Network-based approach highlighting interplay among anti-hypertensives: target coding-genes: diseases","Sharma R.","Sci Rep. 2020 Nov 19;10(1):20152. doi: 10.1038/s41598-020-76605-1.","Sharma R","Sci Rep","2020","2020/11/20","PMC7677320","","10.1038/s41598-020-76605-1"
"33213029","Pangenome Analysis of Mycobacterium tuberculosis Reveals Core-Drug Targets and Screening of Promising Lead Compounds for Drug Discovery","Dar HA, Zaheer T, Ullah N, Bakhtiar SM, Zhang T, Yasir M, Azhar EI, Ali A.","Antibiotics (Basel). 2020 Nov 17;9(11):819. doi: 10.3390/antibiotics9110819.","Dar HA","Antibiotics (Basel)","2020","2020/11/20","PMC7698547","","10.3390/antibiotics9110819"
"33211854","RCSB Protein Data Bank: powerful new tools for exploring 3D structures of biological macromolecules for basic and applied research and education in fundamental biology, biomedicine, biotechnology, bioengineering and energy sciences","Burley SK, Bhikadiya C, Bi C, Bittrich S, Chen L, Crichlow GV, Christie CH, Dalenberg K, Di Costanzo L, Duarte JM, Dutta S, Feng Z, Ganesan S, Goodsell DS, Ghosh S, Green RK, Guranović V, Guzenko D, Hudson BP, Lawson CL, Liang Y, Lowe R, Namkoong H, Peisach E, Persikova I, Randle C, Rose A, Rose Y, Sali A, Segura J, Sekharan M, Shao C, Tao YP, Voigt M, Westbrook JD, Young JY, Zardecki C, Zhuravleva M.","Nucleic Acids Res. 2021 Jan 8;49(D1):D437-D451. doi: 10.1093/nar/gkaa1038.","Burley SK","Nucleic Acids Res","2021","2020/11/19","PMC7779003","","10.1093/nar/gkaa1038"
"33209251","DEEPScreen: high performance drug-target interaction prediction with convolutional neural networks using 2-D structural compound representations","Rifaioglu AS, Nalbat E, Atalay V, Martin MJ, Cetin-Atalay R, Doğan T.","Chem Sci. 2020 Jan 8;11(9):2531-2557. doi: 10.1039/c9sc03414e. eCollection 2020 Mar 7.","Rifaioglu AS","Chem Sci","2020","2020/11/19","PMC7643205","","10.1039/c9sc03414e"
"33209039","Current Challenges and Opportunities in Designing Protein-Protein Interaction Targeted Drugs","Shin WH, Kumazawa K, Imai K, Hirokawa T, Kihara D.","Adv Appl Bioinform Chem. 2020 Nov 12;13:11-25. doi: 10.2147/AABC.S235542. eCollection 2020.","Shin WH","Adv Appl Bioinform Chem","2020","2020/11/19","PMC7669531","","10.2147/AABC.S235542"
"33203679","Targeting the renin-angiotensin signaling pathway in COVID-19: Unanswered questions, opportunities, and challenges","Sriram K, Loomba R, Insel PA.","Proc Natl Acad Sci U S A. 2020 Nov 24;117(47):29274-29282. doi: 10.1073/pnas.2009875117. Epub 2020 Nov 17.","Sriram K","Proc Natl Acad Sci U S A","2020","2020/11/18","PMC7703541","","10.1073/pnas.2009875117"
"33196798","PROMISCUOUS 2.0: a resource for drug-repositioning","Gallo K, Goede A, Eckert A, Moahamed B, Preissner R, Gohlke BO.","Nucleic Acids Res. 2021 Jan 8;49(D1):D1373-D1380. doi: 10.1093/nar/gkaa1061.","Gallo K","Nucleic Acids Res","2021","2020/11/16","PMC7779026","","10.1093/nar/gkaa1061"
"33196098","Network pharmacology evaluation of the active ingredients and potential targets of XiaoLuoWan for application to uterine fibroids","Yu Y, Yang F, Liu H.","Biosci Rep. 2020 Dec 23;40(12):BSR20202342. doi: 10.1042/BSR20202342.","Yu Y","Biosci Rep","2020","2020/11/16","PMC7724689","","10.1042/BSR20202342"
"33195435","Solid Lipid Nanoparticles for Drug Delivery: Pharmacological and Biopharmaceutical Aspects","Scioli Montoto S, Muraca G, Ruiz ME.","Front Mol Biosci. 2020 Oct 30;7:587997. doi: 10.3389/fmolb.2020.587997. eCollection 2020.","Scioli Montoto S","Front Mol Biosci","2020","2020/11/16","PMC7662460","","10.3389/fmolb.2020.587997"
"33193695","Identifying Effective Antiviral Drugs Against SARS-CoV-2 by Drug Repositioning Through Virus-Drug Association Prediction","Peng L, Tian X, Shen L, Kuang M, Li T, Tian G, Yang J, Zhou L.","Front Genet. 2020 Sep 16;11:577387. doi: 10.3389/fgene.2020.577387. eCollection 2020.","Peng L","Front Genet","2020","2020/11/16","PMC7525008","","10.3389/fgene.2020.577387"
"33193567","Identification and Functional Analysis of Long Non-coding RNAs in Autism Spectrum Disorders","Tong Z, Zhou Y, Wang J.","Front Genet. 2020 Sep 16;11:849. doi: 10.3389/fgene.2020.00849. eCollection 2020.","Tong Z","Front Genet","2020","2020/11/16","PMC7525012","","10.3389/fgene.2020.00849"
"33187537","DLDTI: a learning-based framework for drug-target interaction identification using neural networks and network representation","Zhao Y, Zheng K, Guan B, Guo M, Song L, Gao J, Qu H, Wang Y, Shi D, Zhang Y.","J Transl Med. 2020 Nov 13;18(1):434. doi: 10.1186/s12967-020-02602-7.","Zhao Y","J Transl Med","2020","2020/11/14","PMC7666529","","10.1186/s12967-020-02602-7"
"33187508","Virtual screening and network pharmacology-based synergistic mechanism identification of multiple components contained in Guanxin V against coronary artery disease","Liang B, Zhang XX, Gu N.","BMC Complement Med Ther. 2020 Nov 13;20(1):345. doi: 10.1186/s12906-020-03133-w.","Liang B","BMC Complement Med Ther","2020","2020/11/14","PMC7664106","","10.1186/s12906-020-03133-w"
"33184722","Identification of saquinavir as a potent inhibitor of dimeric SARS-CoV2 main protease through MM/GBSA","Bello M, Martínez-Muñoz A, Balbuena-Rebolledo I.","J Mol Model. 2020 Nov 12;26(12):340. doi: 10.1007/s00894-020-04600-4.","Bello M","J Mol Model","2020","2020/11/13","PMC7661016","","10.1007/s00894-020-04600-4"
"33184246","Identification of a repurposed drug as an inhibitor of Spike protein of human coronavirus SARS-CoV-2 by computational methods","Unni S, Aouti S, Thiyagarajan S, Padmanabhan B.","J Biosci. 2020;45(1):130. doi: 10.1007/s12038-020-00102-w.","Unni S","J Biosci","2020","2020/11/13","PMC7561504","","10.1007/s12038-020-00102-w"
"33183223","Quantitative Structure-Mutation-Activity Relationship Tests (QSMART) model for protein kinase inhibitor response prediction","Huang LC, Yeung W, Wang Y, Cheng H, Venkat A, Li S, Ma P, Rasheed K, Kannan N.","BMC Bioinformatics. 2020 Nov 12;21(1):520. doi: 10.1186/s12859-020-03842-6.","Huang LC","BMC Bioinformatics","2020","2020/11/13","PMC7664030","","10.1186/s12859-020-03842-6"
"33179750","Comprehensive mapping of the human cytokine gene regulatory network","Santoso CS, Li Z, Lal S, Yuan S, Gan KA, Agosto LM, Liu X, Pro SC, Sewell JA, Henderson A, Atianand MK, Fuxman Bass JI.","Nucleic Acids Res. 2020 Dec 2;48(21):12055-12073. doi: 10.1093/nar/gkaa1055.","Santoso CS","Nucleic Acids Res","2020","2020/11/12","PMC7708076","","10.1093/nar/gkaa1055"
"33178154","Identification of Growth Inhibitors of the Fish Pathogen Saprolegnia parasitica Using in silico Subtractive Proteomics, Computational Modeling, and Biochemical Validation","Kumar S, Mandal RS, Bulone V, Srivastava V.","Front Microbiol. 2020 Oct 16;11:571093. doi: 10.3389/fmicb.2020.571093. eCollection 2020.","Kumar S","Front Microbiol","2020","2020/11/12","PMC7596660","","10.3389/fmicb.2020.571093"
"33178024","The Interventional Effects of Tubson-2 Decoction on Ovariectomized Rats as Determined by a Combination of Network Pharmacology and Metabolomics","Yang F, Dong X, Ma F, Xu F, Liu J, Lu J, Li C, Bu R, Xue P.","Front Pharmacol. 2020 Oct 14;11:581991. doi: 10.3389/fphar.2020.581991. eCollection 2020.","Yang F","Front Pharmacol","2020","2020/11/12","PMC7593846","","10.3389/fphar.2020.581991"
"33173863","A Workflow of Integrated Resources to Catalyze Network Pharmacology Driven COVID-19 Research","Zahoránszky-Kőhalmi G, Siramshetty VB, Kumar P, Gurumurthy M, Grillo B, Mathew B, Metaxatos D, Backus M, Mierzwa T, Simon R, Grishagin I, Brovold L, Mathé EA, Hall MD, Michael SG, Godfrey AG, Mestres J, Jensen LJ, Oprea TI.","bioRxiv. 2020 Nov 5:2020.11.04.369041. doi: 10.1101/2020.11.04.369041. Preprint.","Zahoránszky-Kőhalmi G","bioRxiv","2020","2020/11/11","PMC7654851","","10.1101/2020.11.04.369041"
"33172092","Drugs Repurposing Using QSAR, Docking and Molecular Dynamics for Possible Inhibitors of the SARS-CoV-2 M(pro) Protease","Tejera E, Munteanu CR, López-Cortés A, Cabrera-Andrade A, Pérez-Castillo Y.","Molecules. 2020 Nov 6;25(21):5172. doi: 10.3390/molecules25215172.","Tejera E","Molecules","2020","2020/11/11","PMC7664330","","10.3390/molecules25215172"
"33169146","Biological network analysis with deep learning","Muzio G, O'Bray L, Borgwardt K.","Brief Bioinform. 2021 Mar 22;22(2):1515-1530. doi: 10.1093/bib/bbaa257.","Muzio G","Brief Bioinform","2021","2020/11/10","PMC7986589","","10.1093/bib/bbaa257"
"33166390","COVID19 Drug Repository: text-mining the literature in search of putative COVID19 therapeutics","Tworowski D, Gorohovski A, Mukherjee S, Carmi G, Levy E, Detroja R, Mukherjee SB, Frenkel-Morgenstern M.","Nucleic Acids Res. 2021 Jan 8;49(D1):D1113-D1121. doi: 10.1093/nar/gkaa969.","Tworowski D","Nucleic Acids Res","2021","2020/11/09","PMC7778969","","10.1093/nar/gkaa969"
"33164550","Individuating Possibly Repurposable Drugs and Drug Targets for COVID-19 Treatment Through Hypothesis-Driven Systems Medicine Using CoVex","Matschinske J, Salgado-Albarrán M, Sadegh S, Bongiovanni D, Baumbach J, Blumenthal DB.","Assay Drug Dev Technol. 2020 Nov/Dec;18(8):348-355. doi: 10.1089/adt.2020.1010. Epub 2020 Nov 6.","Matschinske J","Assay Drug Dev Technol","2020","2020/11/09","PMC7703307","","10.1089/adt.2020.1010"
"33163493","CG4928 Is Vital for Renal Function in Fruit Flies and Membrane Potential in Cells: A First In-Depth Characterization of the Putative Solute Carrier UNC93A","Ceder MM, Aggarwal T, Hosseini K, Maturi V, Patil S, Perland E, Williams MJ, Fredriksson R.","Front Cell Dev Biol. 2020 Oct 14;8:580291. doi: 10.3389/fcell.2020.580291. eCollection 2020.","Ceder MM","Front Cell Dev Biol","2020","2020/11/09","PMC7591606","","10.3389/fcell.2020.580291"
"33159093","Application of physiologically based pharmacokinetic modeling for sertraline dosing recommendations in pregnancy","George B, Lumen A, Nguyen C, Wesley B, Wang J, Beitz J, Crentsil V.","NPJ Syst Biol Appl. 2020 Nov 6;6(1):36. doi: 10.1038/s41540-020-00157-3.","George B","NPJ Syst Biol Appl","2020","2020/11/07","PMC7648747","","10.1038/s41540-020-00157-3"
"33153777","Single-Cell Techniques and Deep Learning in Predicting Drug Response","Wu Z, Lawrence PJ, Ma A, Zhu J, Xu D, Ma Q.","Trends Pharmacol Sci. 2020 Dec;41(12):1050-1065. doi: 10.1016/j.tips.2020.10.004. Epub 2020 Nov 2.","Wu Z","Trends Pharmacol Sci","2020","2020/11/06","PMC7669610","NIHMS1638468","10.1016/j.tips.2020.10.004"
"33151290","PubChem in 2021: new data content and improved web interfaces","Kim S, Chen J, Cheng T, Gindulyte A, He J, He S, Li Q, Shoemaker BA, Thiessen PA, Yu B, Zaslavsky L, Zhang J, Bolton EE.","Nucleic Acids Res. 2021 Jan 8;49(D1):D1388-D1395. doi: 10.1093/nar/gkaa971.","Kim S","Nucleic Acids Res","2021","2020/11/05","PMC7778930","","10.1093/nar/gkaa971"
"33147627","Computational strategies to combat COVID-19: useful tools to accelerate SARS-CoV-2 and coronavirus research","Hufsky F, Lamkiewicz K, Almeida A, Aouacheria A, Arighi C, Bateman A, Baumbach J, Beerenwinkel N, Brandt C, Cacciabue M, Chuguransky S, Drechsel O, Finn RD, Fritz A, Fuchs S, Hattab G, Hauschild AC, Heider D, Hoffmann M, Hölzer M, Hoops S, Kaderali L, Kalvari I, von Kleist M, Kmiecinski R, Kühnert D, Lasso G, Libin P, List M, Löchel HF, Martin MJ, Martin R, Matschinske J, McHardy AC, Mendes P, Mistry J, Navratil V, Nawrocki EP, O'Toole ÁN, Ontiveros-Palacios N, Petrov AI, Rangel-Pineros G, Redaschi N, Reimering S, Reinert K, Reyes A, Richardson L, Robertson DL, Sadegh S, Singer JB, Theys K, Upton C, Welzel M, Williams L, Marz M.","Brief Bioinform. 2021 Mar 22;22(2):642-663. doi: 10.1093/bib/bbaa232.","Hufsky F","Brief Bioinform","2021","2020/11/04","PMC7665365","","10.1093/bib/bbaa232"
"33145486","Generating Multibillion Chemical Space of Readily Accessible Screening Compounds","Grygorenko OO, Radchenko DS, Dziuba I, Chuprina A, Gubina KE, Moroz YS.","iScience. 2020 Oct 15;23(11):101681. doi: 10.1016/j.isci.2020.101681. eCollection 2020 Nov 20.","Grygorenko OO","iScience","2020","2020/11/04","PMC7593547","","10.1016/j.isci.2020.101681"
"33140889","Network pharmacology and molecular docking analyses on Lianhua Qingwen capsule indicate Akt1 is a potential target to treat and prevent COVID-19","Xia QD, Xun Y, Lu JL, Lu YC, Yang YY, Zhou P, Hu J, Li C, Wang SG.","Cell Prolif. 2020 Dec;53(12):e12949. doi: 10.1111/cpr.12949. Epub 2020 Nov 3.","Xia QD","Cell Prolif","2020","2020/11/03","PMC7705900","","10.1111/cpr.12949"
"33127883","Network-based machine learning in colorectal and bladder organoid models predicts anti-cancer drug efficacy in patients","Kong J, Lee H, Kim D, Han SK, Ha D, Shin K, Kim S.","Nat Commun. 2020 Oct 30;11(1):5485. doi: 10.1038/s41467-020-19313-8.","Kong J","Nat Commun","2020","2020/10/31","PMC7599252","","10.1038/s41467-020-19313-8"
"33126128","In silico identification of Tretinoin as a SARS-CoV-2 envelope (E) protein ion channel inhibitor","Dey D, Borkotoky S, Banerjee M.","Comput Biol Med. 2020 Dec;127:104063. doi: 10.1016/j.compbiomed.2020.104063. Epub 2020 Oct 20.","Dey D","Comput Biol Med","2020","2020/10/30","PMC7574788","","10.1016/j.compbiomed.2020.104063"
"33125077","MASI: microbiota-active substance interactions database","Zeng X, Yang X, Fan J, Tan Y, Ju L, Shen W, Wang Y, Wang X, Chen W, Ju D, Chen YZ.","Nucleic Acids Res. 2021 Jan 8;49(D1):D776-D782. doi: 10.1093/nar/gkaa924.","Zeng X","Nucleic Acids Res","2021","2020/10/30","PMC7779062","","10.1093/nar/gkaa924"
"33123783","Historical Evolution and Provider Awareness of Inactive Ingredients in Oral Medications","Reker D, Blum SM, Wade P, Steiger C, Traverso G.","Pharm Res. 2020 Oct 29;37(12):234. doi: 10.1007/s11095-020-02953-2.","Reker D","Pharm Res","2020","2020/10/30","PMC8212167","NIHMS1676771","10.1007/s11095-020-02953-2"
"33123533","Designing a Network Proximity-Based Drug Repurposing Strategy for COVID-19","Stolfi P, Manni L, Soligo M, Vergni D, Tieri P.","Front Cell Dev Biol. 2020 Oct 6;8:545089. doi: 10.3389/fcell.2020.545089. eCollection 2020.","Stolfi P","Front Cell Dev Biol","2020","2020/10/30","PMC7573309","","10.3389/fcell.2020.545089"
"33123211","Molecular Targets and Pathways Contributing to the Effects of Wenxin Keli on Atrial Fibrillation Based on a Network Pharmacology Approach","Zhang Y, Zhang X, Zhang X, Cai Y, Cheng M, Yan C, Han Y.","Evid Based Complement Alternat Med. 2020 Oct 7;2020:8396484. doi: 10.1155/2020/8396484. eCollection 2020.","Zhang Y","Evid Based Complement Alternat Med","2020","2020/10/30","PMC7586041","","10.1155/2020/8396484"
"33121080","Prediction of Suicide-Related Events by Analyzing Electronic Medical Records from PTSD Patients with Bipolar Disorder","Fan P, Guo X, Qi X, Matharu M, Patel R, Sakolsky D, Kirisci L, Silverstein JC, Wang L.","Brain Sci. 2020 Oct 27;10(11):784. doi: 10.3390/brainsci10110784.","Fan P","Brain Sci","2020","2020/10/30","PMC7692143","","10.3390/brainsci10110784"
"33119751","The MemMoRF database for recognizing disordered protein regions interacting with cellular membranes","Csizmadia G, Erdős G, Tordai H, Padányi R, Tosatto S, Dosztányi Z, Hegedűs T.","Nucleic Acids Res. 2021 Jan 8;49(D1):D355-D360. doi: 10.1093/nar/gkaa954.","Csizmadia G","Nucleic Acids Res","2021","2020/10/29","PMC7778998","","10.1093/nar/gkaa954"
"33117900","Assessing the biodegradability of common pharmaceutical products (PPs) on the Zambian market","Nyirenda J, Mwanza A, Lengwe C.","Heliyon. 2020 Oct 21;6(10):e05286. doi: 10.1016/j.heliyon.2020.e05286. eCollection 2020 Oct.","Nyirenda J","Heliyon","2020","2020/10/29","PMC7581924","","10.1016/j.heliyon.2020.e05286"
"33117179","Predicting Transdermal Fentanyl Delivery Using Mechanistic Simulations for Tailored Therapy","Defraeye T, Bahrami F, Ding L, Malini RI, Terrier A, Rossi RM.","Front Pharmacol. 2020 Sep 29;11:585393. doi: 10.3389/fphar.2020.585393. eCollection 2020.","Defraeye T","Front Pharmacol","2020","2020/10/29","PMC7550783","","10.3389/fphar.2020.585393"
"33113799","Linking Pharmacogenomic Information on Drug Safety and Efficacy with Ethnic Minority Populations","Li D, Xie AH, Liu Z, Li D, Ning B, Thakkar S, Tong W, Xu J.","Pharmaceutics. 2020 Oct 25;12(11):1021. doi: 10.3390/pharmaceutics12111021.","Li D","Pharmaceutics","2020","2020/10/29","PMC7693750","","10.3390/pharmaceutics12111021"
"33109630","Checkpoint therapeutic target database (CKTTD): the first comprehensive database for checkpoint targets and their modulators in cancer immunotherapy","Zhang Y, Yao Y, Chen P, Liu Y, Zhang H, Liu H, Liu Y, Xu H, Tian X, Wang Z, Chu P, Zhao D, Liu H, Zhang C, Chen S, Zhao Y, Liu C, Yang Y.","J Immunother Cancer. 2020 Oct;8(2):e001247. doi: 10.1136/jitc-2020-001247.","Zhang Y","J Immunother Cancer","2020","2020/10/28","PMC7592241","","10.1136/jitc-2020-001247"
"33104791","DrugSpaceX: a large screenable and synthetically tractable database extending drug space","Yang T, Li Z, Chen Y, Feng D, Wang G, Fu Z, Ding X, Tan X, Zhao J, Luo X, Chen K, Jiang H, Zheng M.","Nucleic Acids Res. 2021 Jan 8;49(D1):D1170-D1178. doi: 10.1093/nar/gkaa920.","Yang T","Nucleic Acids Res","2021","2020/10/26","PMC7778939","","10.1093/nar/gkaa920"
"33102688","In silico identification of drug candidates against COVID-19","Wu Y, Chang KY, Lou L, Edwards LG, Doma BK, Xie ZR.","Inform Med Unlocked. 2020;21:100461. doi: 10.1016/j.imu.2020.100461. Epub 2020 Oct 20.","Wu Y","Inform Med Unlocked","2020","2020/10/26","PMC7574721","","10.1016/j.imu.2020.100461"
"33099545","Understanding Severe Acute Respiratory Syndrome Coronavirus 2 Replication to Design Efficient Drug Combination Therapies","Ortega JT, Zambrano JL, Jastrzebska B, Liprandi F, Rangel HR, Pujol FH.","Intervirology. 2020;63(1-6):2-9. doi: 10.1159/000512141. Epub 2020 Oct 23.","Ortega JT","Intervirology","2020","2020/10/25","PMC7649723","","10.1159/000512141"
"33098839","System biological investigations of hydroxychloroquine and azithromycin targets and their implications in QT interval prolongation","Khan AA, Khan Z.","Chem Biol Interact. 2020 Dec 1;332:109299. doi: 10.1016/j.cbi.2020.109299. Epub 2020 Oct 22.","Khan AA","Chem Biol Interact","2020","2020/10/25","PMC7578186","","10.1016/j.cbi.2020.109299"
"33098410","Using drug descriptions and molecular structures for drug-drug interaction extraction from literature","Asada M, Miwa M, Sasaki Y.","Bioinformatics. 2021 Jul 19;37(12):1739-1746. doi: 10.1093/bioinformatics/btaa907.","Asada M","Bioinformatics","2021","2020/10/24","PMC8289381","","10.1093/bioinformatics/btaa907"
"33095555","RLDOCK: A New Method for Predicting RNA-Ligand Interactions","Sun LZ, Jiang Y, Zhou Y, Chen SJ.","J Chem Theory Comput. 2020 Nov 10;16(11):7173-7183. doi: 10.1021/acs.jctc.0c00798. Epub 2020 Oct 23.","Sun LZ","J Chem Theory Comput","2020","2020/10/23","PMC7882445","NIHMS1668000","10.1021/acs.jctc.0c00798"
"33087796","Unravelling the antimicrobial action of antidepressants on gut commensal microbes","Ait Chait Y, Mottawea W, Tompkins TA, Hammami R.","Sci Rep. 2020 Oct 21;10(1):17878. doi: 10.1038/s41598-020-74934-9.","Ait Chait Y","Sci Rep","2020","2020/10/22","PMC7578019","","10.1038/s41598-020-74934-9"
"33076254","Merging Ligand-Based and Structure-Based Methods in Drug Discovery: An Overview of Combined Virtual Screening Approaches","Vázquez J, López M, Gibert E, Herrero E, Luque FJ.","Molecules. 2020 Oct 15;25(20):4723. doi: 10.3390/molecules25204723.","Vázquez J","Molecules","2020","2020/10/20","PMC7587536","","10.3390/molecules25204723"
"33074111","Structural and molecular basis of the interaction mechanism of selected drugs towards multiple targets of SARS-CoV-2 by molecular docking and dynamic simulation studies- deciphering the scope of repurposed drugs","Skariyachan S, Gopal D, Chakrabarti S, Kempanna P, Uttarkar A, Muddebihalkar AG, Niranjan V.","Comput Biol Med. 2020 Nov;126:104054. doi: 10.1016/j.compbiomed.2020.104054. Epub 2020 Oct 14.","Skariyachan S","Comput Biol Med","2020","2020/10/19","PMC7554297","","10.1016/j.compbiomed.2020.104054"
"33070389","The BioGRID database: A comprehensive biomedical resource of curated protein, genetic, and chemical interactions","Oughtred R, Rust J, Chang C, Breitkreutz BJ, Stark C, Willems A, Boucher L, Leung G, Kolas N, Zhang F, Dolma S, Coulombe-Huntington J, Chatr-Aryamontri A, Dolinski K, Tyers M.","Protein Sci. 2021 Jan;30(1):187-200. doi: 10.1002/pro.3978. Epub 2020 Nov 23.","Oughtred R","Protein Sci","2021","2020/10/18","PMC7737760","","10.1002/pro.3978"
"33068433","CovalentInDB: a comprehensive database facilitating the discovery of covalent inhibitors","Du H, Gao J, Weng G, Ding J, Chai X, Pang J, Kang Y, Li D, Cao D, Hou T.","Nucleic Acids Res. 2021 Jan 8;49(D1):D1122-D1129. doi: 10.1093/nar/gkaa876.","Du H","Nucleic Acids Res","2021","2020/10/17","PMC7778999","","10.1093/nar/gkaa876"
"33068417","signatureSearch: environment for gene expression signature searching and functional interpretation","Duan Y, Evans DS, Miller RA, Schork NJ, Cummings SR, Girke T.","Nucleic Acids Res. 2020 Dec 2;48(21):e124. doi: 10.1093/nar/gkaa878.","Duan Y","Nucleic Acids Res","2020","2020/10/17","PMC7708038","","10.1093/nar/gkaa878"
"33062633","Computational Approaches in Preclinical Studies on Drug Discovery and Development","Wu F, Zhou Y, Li L, Shen X, Chen G, Wang X, Liang X, Tan M, Huang Z.","Front Chem. 2020 Sep 11;8:726. doi: 10.3389/fchem.2020.00726. eCollection 2020.","Wu F","Front Chem","2020","2020/10/16","PMC7517894","","10.3389/fchem.2020.00726"
"33062007","Potential Molecular Mechanisms of Chaihu-Shugan-San in Treatment of Breast Cancer Based on Network Pharmacology","Xiao K, Li K, Long S, Kong C, Zhu S.","Evid Based Complement Alternat Med. 2020 Sep 25;2020:3670309. doi: 10.1155/2020/3670309. eCollection 2020.","Xiao K","Evid Based Complement Alternat Med","2020","2020/10/16","PMC7533014","","10.1155/2020/3670309"
"33051671","StreptomeDB 3.0: an updated compendium of streptomycetes natural products","Moumbock AFA, Gao M, Qaseem A, Li J, Kirchner PA, Ndingkokhar B, Bekono BD, Simoben CV, Babiaka SB, Malange YI, Sauter F, Zierep P, Ntie-Kang F, Günther S.","Nucleic Acids Res. 2021 Jan 8;49(D1):D600-D604. doi: 10.1093/nar/gkaa868.","Moumbock AFA","Nucleic Acids Res","2021","2020/10/14","PMC7779017","","10.1093/nar/gkaa868"
"33050610","Computer-Aided Estimation of Biological Activity Profiles of Drug-Like Compounds Taking into Account Their Metabolism in Human Body","Filimonov DA, Rudik AV, Dmitriev AV, Poroikov VV.","Int J Mol Sci. 2020 Oct 11;21(20):7492. doi: 10.3390/ijms21207492.","Filimonov DA","Int J Mol Sci","2020","2020/10/14","PMC7593915","","10.3390/ijms21207492"
"33045737","INTEDE: interactome of drug-metabolizing enzymes","Yin J, Li F, Zhou Y, Mou M, Lu Y, Chen K, Xue J, Luo Y, Fu J, He X, Gao J, Zeng S, Yu L, Zhu F.","Nucleic Acids Res. 2021 Jan 8;49(D1):D1233-D1243. doi: 10.1093/nar/gkaa755.","Yin J","Nucleic Acids Res","2021","2020/10/12","PMC7779056","","10.1093/nar/gkaa755"
