PMID,Title,Authors,Citation,First Author,Journal/Book,Publication Year,Create Date,PMCID,NIHMS ID,DOI
"35802522","Valuing the Diversity of Research Methods to Advance Nutrition Science","Mattes RD, Rowe SB, Ohlhorst SD, Brown AW, Hoffman DJ, Liska DJ, Feskens EJM, Dhillon J, Tucker KL, Epstein LH, Neufeld LM, Kelley M, Fukagawa NK, Sunde RA, Zeisel SH, Basile AJ, Borth LE, Jackson E.","Adv Nutr. 2022 Aug 1;13(4):1324-1393. doi: 10.1093/advances/nmac043.","Mattes RD","Adv Nutr","2022","2022/07/08","PMC9340992","","10.1093/advances/nmac043"
"35798960","Enhancing untargeted metabolomics using metadata-based source annotation","Gauglitz JM, West KA, Bittremieux W, Williams CL, Weldon KC, Panitchpakdi M, Di Ottavio F, Aceves CM, Brown E, Sikora NC, Jarmusch AK, Martino C, Tripathi A, Meehan MJ, Dorrestein K, Shaffer JP, Coras R, Vargas F, Goldasich LD, Schwartz T, Bryant M, Humphrey G, Johnson AJ, Spengler K, Belda-Ferre P, Diaz E, McDonald D, Zhu Q, Elijah EO, Wang M, Marotz C, Sprecher KE, Vargas-Robles D, Withrow D, Ackermann G, Herrera L, Bradford BJ, Marques LMM, Amaral JG, Silva RM, Veras FP, Cunha TM, Oliveira RDR, Louzada-Junior P, Mills RH, Piotrowski PK, Servetas SL, Da Silva SM, Jones CM, Lin NJ, Lippa KA, Jackson SA, Daouk RK, Galasko D, Dulai PS, Kalashnikova TI, Wittenberg C, Terkeltaub R, Doty MM, Kim JH, Rhee KE, Beauchamp-Walters J, Wright KP Jr, Dominguez-Bello MG, Manary M, Oliveira MF, Boland BS, Lopes NP, Guma M, Swafford AD, Dutton RJ, Knight R, Dorrestein PC.","Nat Biotechnol. 2022 Dec;40(12):1774-1779. doi: 10.1038/s41587-022-01368-1. Epub 2022 Jul 7.","Gauglitz JM","Nat Biotechnol","2022","2022/07/07","PMC10277029","NIHMS1847844","10.1038/s41587-022-01368-1"
"35796403","The association between plasma metabolites and future risk of all-cause mortality","Yan Y, Smith E, Melander O, Ottosson F.","J Intern Med. 2022 Nov;292(5):804-815. doi: 10.1111/joim.13540. Epub 2022 Jul 26.","Yan Y","J Intern Med","2022","2022/07/07","PMC9796397","","10.1111/joim.13540"
"35795688","First Metabolomic Signature of Blood-Brain Barrier Opening Induced by Microbubble-Assisted Ultrasound","Presset A, Bodard S, Lefèvre A, Millet A, Oujagir E, Dupuy C, Iazourène T, Bouakaz A, Emond P, Escoffre JM, Nadal-Desbarats L.","Front Mol Neurosci. 2022 Jun 20;15:888318. doi: 10.3389/fnmol.2022.888318. eCollection 2022.","Presset A","Front Mol Neurosci","2022","2022/07/07","PMC9251546","","10.3389/fnmol.2022.888318"
"35782075","Metabolomics of Esophageal Squamous Cell Carcinoma Tissues: Potential Biomarkers for Diagnosis and Promising Targets for Therapy","Xu J, Cao W, Shao A, Yang M, Andoh V, Ge Q, Pan HW, Chen KP.","Biomed Res Int. 2022 Jun 23;2022:7819235. doi: 10.1155/2022/7819235. eCollection 2022.","Xu J","Biomed Res Int","2022","2022/07/05","PMC9246618","","10.1155/2022/7819235"
"35758813","Deep kernel learning improves molecular fingerprint prediction from tandem mass spectra","Dührkop K.","Bioinformatics. 2022 Jun 24;38(Suppl 1):i342-i349. doi: 10.1093/bioinformatics/btac260.","Dührkop K","Bioinformatics","2022","2022/06/27","PMC9235503","","10.1093/bioinformatics/btac260"
"35756524","Metabolomics studies of cell-cell interactions using single cell mass spectrometry combined with fluorescence microscopy","Chen X, Peng Z, Yang Z.","Chem Sci. 2022 May 16;13(22):6687-6695. doi: 10.1039/d2sc02298b. eCollection 2022 Jun 7.","Chen X","Chem Sci","2022","2022/06/27","PMC9172575","","10.1039/d2sc02298b"
"35752802","specificity: an R package for analysis of feature specificity to environmental and higher dimensional variables, applied to microbiome species data","Darcy JL, Amend AS, Swift SOI, Sommers PS, Lozupone CA.","Environ Microbiome. 2022 Jun 25;17(1):34. doi: 10.1186/s40793-022-00426-0.","Darcy JL","Environ Microbiome","2022","2022/06/25","PMC9233361","","10.1186/s40793-022-00426-0"
"35744782","Deep Learning-Based Method for Compound Identification in NMR Spectra of Mixtures","Wei W, Liao Y, Wang Y, Wang S, Du W, Lu H, Kong B, Yang H, Zhang Z.","Molecules. 2022 Jun 7;27(12):3653. doi: 10.3390/molecules27123653.","Wei W","Molecules","2022","2022/06/24","PMC9227391","","10.3390/molecules27123653"
"35741667","Selective Probiotic Treatment Positively Modulates the Microbiota-Gut-Brain Axis in the BTBR Mouse Model of Autism","Pochakom A, Mu C, Rho JM, Tompkins TA, Mayengbam S, Shearer J.","Brain Sci. 2022 Jun 14;12(6):781. doi: 10.3390/brainsci12060781.","Pochakom A","Brain Sci","2022","2022/06/24","PMC9220969","","10.3390/brainsci12060781"
"35740505","Metabolomic Analysis Points to Bioactive Lipid Species and Acireductone Dioxygenase 1 (ADI1) as Potential Therapeutic Targets in Poor Prognosis Endometrial Cancer","Gatius S, Jove M, Megino-Luque C, Albertí-Valls M, Yeramian A, Bonifaci N, Piñol M, Santacana M, Pradas I, Llobet-Navas D, Pamplona R, Matías-Guiu X, Eritja N.","Cancers (Basel). 2022 Jun 8;14(12):2842. doi: 10.3390/cancers14122842.","Gatius S","Cancers (Basel)","2022","2022/06/24","PMC9220847","","10.3390/cancers14122842"
"35740067","Identification and Quantification of Urinary Microbial Phenolic Metabolites by HPLC-ESI-LTQ-Orbitrap-HRMS and Their Relationship with Dietary Polyphenols in Adolescents","Laveriano-Santos EP, Marhuenda-Muñoz M, Vallverdú-Queralt A, Martínez-Huélamo M, Tresserra-Rimbau A, Miliarakis E, Arancibia-Riveros C, Jáuregui O, Ruiz-León AM, Castro-Baquero S, Estruch R, Bodega P, Miguel M, Cos-Gandoy A, Martínez-Gómez J, Santos-Beneit G, Fernández-Alvira JM, Fernández-Jiménez R, Lamuela-Raventós RM.","Antioxidants (Basel). 2022 Jun 14;11(6):1167. doi: 10.3390/antiox11061167.","Laveriano-Santos EP","Antioxidants (Basel)","2022","2022/06/24","PMC9220091","","10.3390/antiox11061167"
"35736470","Urine and Fecal (1)H-NMR Metabolomes Differ Significantly between Pre-Term and Full-Term Born Physically Fit Healthy Adult Males","Deutsch L, Debevec T, Millet GP, Osredkar D, Opara S, Šket R, Murovec B, Mramor M, Plavec J, Stres B.","Metabolites. 2022 Jun 10;12(6):536. doi: 10.3390/metabo12060536.","Deutsch L","Metabolites","2022","2022/06/23","PMC9228004","","10.3390/metabo12060536"
"35736453","Biofluid Metabolomics and Lipidomics of Mice Exposed to External Very High-Dose Rate Radiation","Pannkuk EL, Laiakis EC, Garty G, Bansal S, Ponnaiya B, Wu X, Ghandhi SA, Amundson SA, Brenner DJ, Fornace AJ Jr.","Metabolites. 2022 Jun 4;12(6):520. doi: 10.3390/metabo12060520.","Pannkuk EL","Metabolites","2022","2022/06/23","PMC9228171","","10.3390/metabo12060520"
"35727046","Genomic, Metabolic, and Immunological Characterization of GMP-Grade Mycobacterium phlei","Qiu T, Luo G, Jiang J, Ding P, Li Q.","Microbiol Spectr. 2022 Aug 31;10(4):e0007022. doi: 10.1128/spectrum.00070-22. Epub 2022 Jun 21.","Qiu T","Microbiol Spectr","2022","2022/06/21","PMC9430659","","10.1128/spectrum.00070-22"
"35726252","Understanding the Significance of Sample Preparation in Studies of the Nanoparticle Metabolite Corona","Zhang W, Chetwynd AJ, Thorn JA, Lynch I, Ramautar R.","ACS Meas Sci Au. 2022 Jun 15;2(3):251-260. doi: 10.1021/acsmeasuresciau.2c00003. Epub 2022 Feb 24.","Zhang W","ACS Meas Sci Au","2022","2022/06/21","PMC9204816","","10.1021/acsmeasuresciau.2c00003"
"35721499","Integrated Analysis of Glutathione Metabolic Pathway in Pancreatic Cancer","Wu X, Yu R, Yang M, Hu Y, Tang M, Zhang S, Abudourousuli A, Li X, Li Z, Liao X, Xu Y, Li M, Chen S, Qian W, Feng R, Li J, Li F.","Front Cell Dev Biol. 2022 Jun 3;10:896136. doi: 10.3389/fcell.2022.896136. eCollection 2022.","Wu X","Front Cell Dev Biol","2022","2022/06/20","PMC9204196","","10.3389/fcell.2022.896136"
"35719971","Metabolic Alterations in Sputum and Exhaled Breath Condensate of Early Stage Non-Small Cell Lung Cancer Patients After Surgical Resection: A Pilot Study","Ahmed N, Kidane B, Wang L, Nugent Z, Moldovan N, McElrea A, Shariati-Ievari S, Qing G, Tan L, Buduhan G, Srinathan SK, Meyers R, Aliani M.","Front Oncol. 2022 Jun 3;12:874964. doi: 10.3389/fonc.2022.874964. eCollection 2022.","Ahmed N","Front Oncol","2022","2022/06/20","PMC9204221","","10.3389/fonc.2022.874964"
"35715864","Identification of characteristic metabolic panels for different stages of prostate cancer by (1)H NMR-based metabolomics analysis","Zhang X, Xia B, Zheng H, Ning J, Zhu Y, Shao X, Liu B, Dong B, Gao H.","J Transl Med. 2022 Jun 17;20(1):275. doi: 10.1186/s12967-022-03478-5.","Zhang X","J Transl Med","2022","2022/06/17","PMC9205125","","10.1186/s12967-022-03478-5"
"35713879","Single-Cell Metabolic Profiling of Macrophages Using 3D OrbiSIMS: Correlations with Phenotype","Suvannapruk W, Edney MK, Kim DH, Scurr DJ, Ghaemmaghami AM, Alexander MR.","Anal Chem. 2022 Jul 5;94(26):9389-9398. doi: 10.1021/acs.analchem.2c01375. Epub 2022 Jun 17.","Suvannapruk W","Anal Chem","2022","2022/06/17","PMC9260720","","10.1021/acs.analchem.2c01375"
"35707722","Host-genotype-dependent cecal microbes are linked to breast muscle metabolites in Chinese chickens","Feng Y, Liu D, Liu Y, Yang X, Zhang M, Wei F, Li D, Hu Y, Guo Y.","iScience. 2022 May 26;25(6):104469. doi: 10.1016/j.isci.2022.104469. eCollection 2022 Jun 17.","Feng Y","iScience","2022","2022/06/16","PMC9189123","","10.1016/j.isci.2022.104469"
"35703366","The metabolome of Mexican cavefish shows a convergent signature highlighting sugar, antioxidant, and Ageing-Related metabolites","Medley JK, Persons J, Biswas T, Olsen L, Peuß R, Krishnan J, Xiong S, Rohner N.","Elife. 2022 Jun 15;11:e74539. doi: 10.7554/eLife.74539.","Medley JK","Elife","2022","2022/06/15","PMC9200406","","10.7554/eLife.74539"
"35699774","PeakForest: a multi-platform digital infrastructure for interoperable metabolite spectral data and metadata management","Paulhe N, Canlet C, Damont A, Peyriga L, Durand S, Deborde C, Alves S, Bernillon S, Berton T, Bir R, Bouville A, Cahoreau E, Centeno D, Costantino R, Debrauwer L, Delabrière A, Duperier C, Emery S, Flandin A, Hohenester U, Jacob D, Joly C, Jousse C, Lagree M, Lamari N, Lefebvre M, Lopez-Piffet C, Lyan B, Maucourt M, Migne C, Olivier MF, Rathahao-Paris E, Petriacq P, Pinelli J, Roch L, Roger P, Roques S, Tabet JC, Tremblay-Franco M, Traïkia M, Warnet A, Zhendre V, Rolin D, Jourdan F, Thévenot E, Moing A, Jamin E, Fenaille F, Junot C, Pujos-Guillot E, Giacomoni F.","Metabolomics. 2022 Jun 14;18(6):40. doi: 10.1007/s11306-022-01899-3.","Paulhe N","Metabolomics","2022","2022/06/14","PMC9197906","","10.1007/s11306-022-01899-3"
"35681802","Duodenal Metabolic Profile Changes in Heat-Stressed Broilers","Dridi JS, Greene ES, Maynard CW, Brugaletta G, Ramser A, Christopher CJ, Campagna SR, Castro HF, Dridi S.","Animals (Basel). 2022 May 24;12(11):1337. doi: 10.3390/ani12111337.","Dridi JS","Animals (Basel)","2022","2022/06/10","PMC9179521","","10.3390/ani12111337"
"35676822","Integrative metabolomics and transcriptomics analysis reveals novel therapeutic vulnerabilities in lung cancer","Thaiparambil J, Dong J, Grimm SL, Perera D, Ambati CSR, Putluri V, Robertson MJ, Patel TD, Mistretta B, Gunaratne PH, Kim MP, Yustein JT, Putluri N, Coarfa C, El-Zein R.","Cancer Med. 2023 Jan;12(1):584-596. doi: 10.1002/cam4.4933. Epub 2022 Jun 8.","Thaiparambil J","Cancer Med","2023","2022/06/09","PMC9844651","","10.1002/cam4.4933"
"35672784","Probabilistic metabolite annotation using retention time prediction and meta-learned projections","García CA, Gil-de-la-Fuente A, Barbas C, Otero A.","J Cheminform. 2022 Jun 7;14(1):33. doi: 10.1186/s13321-022-00613-8.","García CA","J Cheminform","2022","2022/06/07","PMC9172150","","10.1186/s13321-022-00613-8"
"35668092","High-throughput metabolomics reveals dysregulation of hydrophobic metabolomes in cancer cell lines by Eleusine indica","Puah PY, Lee DJH, Puah SH, Lah NASN, Ling YS, Fong SY.","Sci Rep. 2022 Jun 6;12(1):9347. doi: 10.1038/s41598-022-13575-6.","Puah PY","Sci Rep","2022","2022/06/06","PMC9168358","","10.1038/s41598-022-13575-6"
"35664224","MIAOME: Human microbiome affect the host epigenome","Wang L, Zhang W, Wu X, Liang X, Cao L, Zhai J, Yang Y, Chen Q, Liu H, Zhang J, Ding Y, Zhu F, Tang J.","Comput Struct Biotechnol J. 2022 May 17;20:2455-2463. doi: 10.1016/j.csbj.2022.05.024. eCollection 2022.","Wang L","Comput Struct Biotechnol J","2022","2022/06/06","PMC9136154","","10.1016/j.csbj.2022.05.024"
"35656096","Recent Advances in Understanding of Alzheimer's Disease Progression through Mass Spectrometry-Based Metabolomics","Mill J, Li L.","Phenomics. 2022 Feb;2(1):1-17. doi: 10.1007/s43657-021-00036-9. Epub 2022 Feb 22.","Mill J","Phenomics","2022","2022/06/03","PMC9159642","NIHMS1772924","10.1007/s43657-021-00036-9"
"35655880","An open source computational workflow for the discovery of autocatalytic networks in abiotic reactions","Arya A, Ray J, Sharma S, Cruz Simbron R, Lozano A, Smith HB, Andersen JL, Chen H, Meringer M, Cleaves HJ 2nd.","Chem Sci. 2022 Mar 23;13(17):4838-4853. doi: 10.1039/d2sc00256f. eCollection 2022 May 4.","Arya A","Chem Sci","2022","2022/06/03","PMC9067619","","10.1039/d2sc00256f"
"35653285","Uncovering PFAS and Other Xenobiotics in the Dark Metabolome Using Ion Mobility Spectrometry, Mass Defect Analysis, and Machine Learning","Foster M, Rainey M, Watson C, Dodds JN, Kirkwood KI, Fernández FM, Baker ES.","Environ Sci Technol. 2022 Jun 21;56(12):9133-9143. doi: 10.1021/acs.est.2c00201. Epub 2022 Jun 2.","Foster M","Environ Sci Technol","2022","2022/06/02","PMC9474714","NIHMS1820373","10.1021/acs.est.2c00201"
"35641653","Short-chain fatty acids promote the effect of environmental signals on the gut microbiome and metabolome in mice","Marrocco F, Delli Carpini M, Garofalo S, Giampaoli O, De Felice E, Di Castro MA, Maggi L, Scavizzi F, Raspa M, Marini F, Tomassini A, Nicolosi R, Cason C, Trettel F, Miccheli A, Iebba V, D'Alessandro G, Limatola C.","Commun Biol. 2022 May 31;5(1):517. doi: 10.1038/s42003-022-03468-9.","Marrocco F","Commun Biol","2022","2022/05/31","PMC9156677","","10.1038/s42003-022-03468-9"
"35637304","MSNovelist: de novo structure generation from mass spectra","Stravs MA, Dührkop K, Böcker S, Zamboni N.","Nat Methods. 2022 Jul;19(7):865-870. doi: 10.1038/s41592-022-01486-3. Epub 2022 May 30.","Stravs MA","Nat Methods","2022","2022/05/31","PMC9262714","","10.1038/s41592-022-01486-3"
"35629950","Circulating Metabolites as Biomarkers of Disease in Patients with Mesial Temporal Lobe Epilepsy","Godoi AB, do Canto AM, Donatti A, Rosa DC, Bruno DCF, Alvim MK, Yasuda CL, Martins LG, Quintero M, Tasic L, Cendes F, Lopes-Cendes I.","Metabolites. 2022 May 17;12(5):446. doi: 10.3390/metabo12050446.","Godoi AB","Metabolites","2022","2022/05/28","PMC9148034","","10.3390/metabo12050446"
"35629918","The Human Meconium Metabolome and Its Evolution during the First Days of Life","Bekhti N, Castelli F, Paris A, Guillon B, Junot C, Moiron C, Fenaille F, Adel-Patient K.","Metabolites. 2022 May 5;12(5):414. doi: 10.3390/metabo12050414.","Bekhti N","Metabolites","2022","2022/05/28","PMC9147484","","10.3390/metabo12050414"
"35629884","Evaluating Cefoperazone-Induced Gut Metabolic Functional Changes in MR1-Deficient Mice","Sun J, Cao Z, Smith AD, Carlson PE Jr, Coryell M, Chen H, Beger RD.","Metabolites. 2022 Apr 22;12(5):380. doi: 10.3390/metabo12050380.","Sun J","Metabolites","2022","2022/05/28","PMC9146321","","10.3390/metabo12050380"
"35625132","Metabolomic Analysis Reveals That the Moor Frog Rana arvalis Uses Both Glucose and Glycerol as Cryoprotectants","Shekhovtsov SV, Bulakhova NA, Tsentalovich YP, Zelentsova EA, Meshcheryakova EN, Poluboyarova TV, Berman DI.","Animals (Basel). 2022 May 17;12(10):1286. doi: 10.3390/ani12101286.","Shekhovtsov SV","Animals (Basel)","2022","2022/05/28","PMC9137551","","10.3390/ani12101286"
"35621972","Application of MS-Based Metabolomic Approaches in Analysis of Starfish and Sea Cucumber Bioactive Compounds","Popov RS, Ivanchina NV, Dmitrenok PS.","Mar Drugs. 2022 May 12;20(5):320. doi: 10.3390/md20050320.","Popov RS","Mar Drugs","2022","2022/05/27","PMC9147407","","10.3390/md20050320"
"35615022","OncoboxPD: human 51 672 molecular pathways database with tools for activity calculating and visualization","Zolotovskaia MA, Tkachev VS, Guryanova AA, Simonov AM, Raevskiy MM, Efimov VV, Wang Y, Sekacheva MI, Garazha AV, Borisov NM, Kuzmin DV, Sorokin MI, Buzdin AA.","Comput Struct Biotechnol J. 2022 May 10;20:2280-2291. doi: 10.1016/j.csbj.2022.05.006. eCollection 2022.","Zolotovskaia MA","Comput Struct Biotechnol J","2022","2022/05/26","PMC9120235","","10.1016/j.csbj.2022.05.006"
"35614331","Belgian endive-derived biostimulants promote shoot and root growth in vitro","Ogunsanya HY, Motti P, Li J, Trinh HK, Xu L, Bernaert N, Van Droogenbroeck B, Murvanidze N, Werbrouck SPO, Mangelinckx S, Ramirez A, Geelen D.","Sci Rep. 2022 May 25;12(1):8792. doi: 10.1038/s41598-022-12815-z.","Ogunsanya HY","Sci Rep","2022","2022/05/25","PMC9132888","","10.1038/s41598-022-12815-z"
"35602483","The Integration of Proteomics and Metabolomics Data Paving the Way for a Better Understanding of the Mechanisms Underlying Microbial Acquired Drug Resistance","Fortuin S, Soares NC.","Front Med (Lausanne). 2022 May 6;9:849838. doi: 10.3389/fmed.2022.849838. eCollection 2022.","Fortuin S","Front Med (Lausanne)","2022","2022/05/23","PMC9120609","","10.3389/fmed.2022.849838"
"35602306","A rapid LC-MS/MS assay for detection and monitoring of underivatized branched-chain amino acids in maple syrup urine disease","Piri-Moghadam H, Miller A, Pronger D, Vicente F, Charrow J, Haymond S, Lin DC.","J Mass Spectrom Adv Clin Lab. 2022 Apr 30;24:107-117. doi: 10.1016/j.jmsacl.2022.04.003. eCollection 2022 Apr.","Piri-Moghadam H","J Mass Spectrom Adv Clin Lab","2022","2022/05/23","PMC9120951","","10.1016/j.jmsacl.2022.04.003"
"35593195","Spatial metabolomics for evaluating response to neoadjuvant therapy in non-small cell lung cancer patients","Shen J, Sun N, Zens P, Kunzke T, Buck A, Prade VM, Wang J, Wang Q, Hu R, Feuchtinger A, Berezowska S, Walch A.","Cancer Commun (Lond). 2022 Jun;42(6):517-535. doi: 10.1002/cac2.12310. Epub 2022 May 20.","Shen J","Cancer Commun (Lond)","2022","2022/05/20","PMC9198346","","10.1002/cac2.12310"
"35565391","Space- and Time-Resolved Metabolomics of a High-Grade Serous Ovarian Cancer Mouse Model","Sah S, Ma X, Botros A, Gaul DA, Yun SR, Park EY, Kim O, Moore SG, Kim J, Fernández FM.","Cancers (Basel). 2022 Apr 30;14(9):2262. doi: 10.3390/cancers14092262.","Sah S","Cancers (Basel)","2022","2022/05/14","PMC9104348","","10.3390/cancers14092262"
"35561172","Improving confidence in lipidomic annotations by incorporating empirical ion mobility regression analysis and chemical class prediction","Rose BS, May JC, Picache JA, Codreanu SG, Sherrod SD, McLean JA.","Bioinformatics. 2022 May 13;38(10):2872-2879. doi: 10.1093/bioinformatics/btac197.","Rose BS","Bioinformatics","2022","2022/05/13","PMC9306740","","10.1093/bioinformatics/btac197"
"35557670","Untargeted Metabolomics Sensitively Differentiates Gut Bacterial Species in Single Culture and Co-Culture Systems","Zhang S, Zhu J.","ACS Omega. 2022 Apr 22;7(17):14643-14652. doi: 10.1021/acsomega.1c07114. eCollection 2022 May 3.","Zhang S","ACS Omega","2022","2022/05/13","PMC9088763","","10.1021/acsomega.1c07114"
"35546254","Application of metabolite set enrichment analysis on untargeted metabolomics data prioritises relevant pathways and detects novel biomarkers for inherited metabolic disorders","Hoegen B, Hampstead JE, Engelke UFH, Kulkarni P, Wevers RA, Brunner HG, Coene KLM, Gilissen C.","J Inherit Metab Dis. 2022 Jul;45(4):682-695. doi: 10.1002/jimd.12522. Epub 2022 May 22.","Hoegen B","J Inherit Metab Dis","2022","2022/05/13","PMC9544878","","10.1002/jimd.12522"
"35538056","A randomized controlled trial for response of microbiome network to exercise and diet intervention in patients with nonalcoholic fatty liver disease","Cheng R, Wang L, Le S, Yang Y, Zhao C, Zhang X, Yang X, Xu T, Xu L, Wiklund P, Ge J, Lu D, Zhang C, Chen L, Cheng S.","Nat Commun. 2022 May 10;13(1):2555. doi: 10.1038/s41467-022-29968-0.","Cheng R","Nat Commun","2022","2022/05/10","PMC9091228","","10.1038/s41467-022-29968-0"
"35527238","An optimal variant to gene distance window derived from an empirical definition of cis and trans protein QTLs","Fauman EB, Hyde C.","BMC Bioinformatics. 2022 May 8;23(1):169. doi: 10.1186/s12859-022-04706-x.","Fauman EB","BMC Bioinformatics","2022","2022/05/08","PMC9082853","","10.1186/s12859-022-04706-x"
"35524818","Differences in Exudates Between Strains of Chlorella sorokiniana Affect the Interaction with the Microalga Growth-Promoting Bacteria Azospirillum brasilense : Differences in Exudates Between Strains of Chlorella sorokiniana Affect the Interaction with the Microalga Growth-Promoting Bacteria Azospirillum brasilense","Palacios OA, Espinoza-Hicks JC, Camacho-Dávila AA, López BR, de-Bashan LE.","Microb Ecol. 2023 May;85(4):1412-1422. doi: 10.1007/s00248-022-02026-4. Epub 2022 May 7.","Palacios OA","Microb Ecol","2023","2022/05/07","","","10.1007/s00248-022-02026-4"
"35523209","The N-Terminus of Human Sulfotransferase 2B1b─a Sterol-Sensing Allosteric Site","Cook I, Leyh TS.","Biochemistry. 2022 May 17;61(10):843-855. doi: 10.1021/acs.biochem.1c00740. Epub 2022 May 6.","Cook I","Biochemistry","2022","2022/05/06","PMC9260854","NIHMS1820463","10.1021/acs.biochem.1c00740"
"35495641","Enzyme Promiscuity in Serotonin Biosynthesis, From Bacteria to Plants and Humans","Gonçalves S, Nunes-Costa D, Cardoso SM, Empadinhas N, Marugg JD.","Front Microbiol. 2022 Apr 14;13:873555. doi: 10.3389/fmicb.2022.873555. eCollection 2022.","Gonçalves S","Front Microbiol","2022","2022/05/02","PMC9048412","","10.3389/fmicb.2022.873555"
"35494758","Investigation of the individual human sulfatome in plasma and urine samples reveals an age-dependency","Correia MSP, Thapa B, Vujasinovic M, Löhr JM, Globisch D.","RSC Adv. 2021 Oct 28;11(55):34788-34794. doi: 10.1039/d1ra05994g. eCollection 2021 Oct 25.","Correia MSP","RSC Adv","2021","2022/05/02","PMC9042682","","10.1039/d1ra05994g"
"35494234","Metabolomics-based phenotypic screens for evaluation of drug synergy via direct-infusion mass spectrometry","Lu X, Hackman GL, Saha A, Rathore AS, Collins M, Friedman C, Yi SS, Matsuda F, DiGiovanni J, Lodi A, Tiziani S.","iScience. 2022 Apr 7;25(5):104221. doi: 10.1016/j.isci.2022.104221. eCollection 2022 May 20.","Lu X","iScience","2022","2022/05/02","PMC9046262","","10.1016/j.isci.2022.104221"
"35493175","Variable-temperature NMR spectroscopy for metabolite identification in biological materials","Nawrocka EK, Urbańczyk M, Koziński K, Kazimierczuk K.","RSC Adv. 2021 Nov 3;11(56):35321-35325. doi: 10.1039/d1ra05626c. eCollection 2021 Oct 28.","Nawrocka EK","RSC Adv","2021","2022/05/02","PMC9043013","","10.1039/d1ra05626c"
"35484129","Metabolic preference assay for rapid diagnosis of bloodstream infections","Rydzak T, Groves RA, Zhang R, Aburashed R, Pushpker R, Mapar M, Lewis IA.","Nat Commun. 2022 Apr 28;13(1):2332. doi: 10.1038/s41467-022-30048-6.","Rydzak T","Nat Commun","2022","2022/04/28","PMC9050716","","10.1038/s41467-022-30048-6"
"35473873","Single cell mass spectrometry studies reveal metabolomic features and potential mechanisms of drug-resistant cancer cell lines","Sun M, Chen X, Yang Z.","Anal Chim Acta. 2022 May 8;1206:339761. doi: 10.1016/j.aca.2022.339761. Epub 2022 Apr 1.","Sun M","Anal Chim Acta","2022","2022/04/27","PMC9046687","NIHMS1796454","10.1016/j.aca.2022.339761"
"35470187","Prediction of pregnancy-related hypertensive disorders using metabolomics: a systematic review","Mayrink J, Leite DF, Nobrega GM, Costa ML, Cecatti JG.","BMJ Open. 2022 Apr 25;12(4):e054697. doi: 10.1136/bmjopen-2021-054697.","Mayrink J","BMJ Open","2022","2022/04/26","PMC9039389","","10.1136/bmjopen-2021-054697"
"35464220","Comprehending Cardiac Dysfunction by Oxidative Stress: Untargeted Metabolomics of In Vitro Samples","Amaral AG, Moretto IA, Zandonadi FDS, Zamora-Obando HR, Rocha I, Sussulini A, de Thomaz AA, Oliveira RV, Dos Santos AM, Simionato AVC.","Front Chem. 2022 Apr 8;10:836478. doi: 10.3389/fchem.2022.836478. eCollection 2022.","Amaral AG","Front Chem","2022","2022/04/25","PMC9023746","","10.3389/fchem.2022.836478"
"35458777","Compositional Analysis of Four Kinds of Citrus Fruits with an NMR-Based Method for Understanding Nutritional Value and Rational Utilization: From Pericarp to Juice","Pei Y, He C, Liu H, Shen G, Feng J.","Molecules. 2022 Apr 16;27(8):2579. doi: 10.3390/molecules27082579.","Pei Y","Molecules","2022","2022/04/23","PMC9031779","","10.3390/molecules27082579"
"35458694","Food Ingredients Derived from Lemongrass Byproduct Hydrodistillation: Essential Oil, Hydrolate, and Decoction","Rodrigues L, Coelho E, Madeira R, Teixeira P, Henriques I, Coimbra MA.","Molecules. 2022 Apr 12;27(8):2493. doi: 10.3390/molecules27082493.","Rodrigues L","Molecules","2022","2022/04/23","PMC9028273","","10.3390/molecules27082493"
"35448548","HBM4EU Chromates Study: Urinary Metabolomics Study of Workers Exposed to Hexavalent Chromium","Kozłowska L, Santonen T, Duca RC, Godderis L, Jagiello K, Janasik B, Van Nieuwenhuyse A, Poels K, Puzyn T, Scheepers PTJ, Sijko M, Silva MJ, Sosnowska A, Viegas S, Verdonck J, Wąsowicz W, On Behalf Of Hbm Eu Chromates Study Team, On Behalf Of Statistical Team.","Metabolites. 2022 Apr 18;12(4):362. doi: 10.3390/metabo12040362.","Kozłowska L","Metabolites","2022","2022/04/21","PMC9032989","","10.3390/metabo12040362"
"35448542","Guide to Metabolomics Analysis: A Bioinformatics Workflow","Chen Y, Li EM, Xu LY.","Metabolites. 2022 Apr 15;12(4):357. doi: 10.3390/metabo12040357.","Chen Y","Metabolites","2022","2022/04/21","PMC9032224","","10.3390/metabo12040357"
