PMID,Title,Authors,Citation,First Author,Journal/Book,Publication Year,Create Date,PMCID,NIHMS ID,DOI
"31672995","STATegra, a comprehensive multi-omics dataset of B-cell differentiation in mouse","Gomez-Cabrero D, Tarazona S, Ferreirós-Vidal I, Ramirez RN, Company C, Schmidt A, Reijmers T, Paul VVS, Marabita F, Rodríguez-Ubreva J, Garcia-Gomez A, Carroll T, Cooper L, Liang Z, Dharmalingam G, van der Kloet F, Harms AC, Balzano-Nogueira L, Lagani V, Tsamardinos I, Lappe M, Maier D, Westerhuis JA, Hankemeier T, Imhof A, Ballestar E, Mortazavi A, Merkenschlager M, Tegner J, Conesa A.","Sci Data. 2019 Oct 31;6(1):256. doi: 10.1038/s41597-019-0202-7.","Gomez-Cabrero D","Sci Data","2019","2019/11/02","PMC6823427","","10.1038/s41597-019-0202-7"
"31672983","The Signaling Pathways Project, an integrated 'omics knowledgebase for mammalian cellular signaling pathways","Ochsner SA, Abraham D, Martin K, Ding W, McOwiti A, Kankanamge W, Wang Z, Andreano K, Hamilton RA, Chen Y, Hamilton A, Gantner ML, Dehart M, Qu S, Hilsenbeck SG, Becnel LB, Bridges D, Ma'ayan A, Huss JM, Stossi F, Foulds CE, Kralli A, McDonnell DP, McKenna NJ.","Sci Data. 2019 Oct 31;6(1):252. doi: 10.1038/s41597-019-0193-4.","Ochsner SA","Sci Data","2019","2019/11/02","PMC6823428","","10.1038/s41597-019-0193-4"
"31672978","Making multi-omics data accessible to researchers","Conesa A, Beck S.","Sci Data. 2019 Oct 31;6(1):251. doi: 10.1038/s41597-019-0258-4.","Conesa A","Sci Data","2019","2019/11/02","PMC6823467","","10.1038/s41597-019-0258-4"
"31216675","Integration of Metabolomic and Other Omics Data in Population-Based Study Designs: An Epidemiological Perspective","Chu SH, Huang M, Kelly RS, Benedetti E, Siddiqui JK, Zeleznik OA, Pereira A, Herrington D, Wheelock CE, Krumsiek J, McGeachie M, Moore SC, Kraft P, Mathé E, Lasky-Su J; Consortium of Metabolomics Studies Statistics Working Group.","Metabolites. 2019 Jun 18;9(6):117. doi: 10.3390/metabo9060117.","Chu SH","Metabolites","2019","2019/06/21","PMC6630728","","10.3390/metabo9060117"
"31185456","Multiomics Analyses of HNF4α Protein Domain Function during Human Pluripotent Stem Cell Differentiation","Wang Y, Tatham MH, Schmidt-Heck W, Swann C, Singh-Dolt K, Meseguer-Ripolles J, Lucendo-Villarin B, Kunath T, Rudd TR, Smith AJH, Hengstler JG, Godoy P, Hay RT, Hay DC.","iScience. 2019 Jun 28;16:206-217. doi: 10.1016/j.isci.2019.05.028. Epub 2019 May 24.","Wang Y","iScience","2019","2019/06/12","PMC6556878","","10.1016/j.isci.2019.05.028"
"31142576","Graph Algorithms for Condensing and Consolidating Gene Set Analysis Results","Savage SR, Shi Z, Liao Y, Zhang B.","Mol Cell Proteomics. 2019 Aug 9;18(8 suppl 1):S141-S152. doi: 10.1074/mcp.TIR118.001263. Epub 2019 May 29.","Savage SR","Mol Cell Proteomics","2019","2019/05/31","PMC6692773","","10.1074/mcp.TIR118.001263"
"31052521","Using Pathway Covering to Explore Connections among Metabolites","Midford PE, Latendresse M, O'Maille PE, Karp PD.","Metabolites. 2019 May 2;9(5):88. doi: 10.3390/metabo9050088.","Midford PE","Metabolites","2019","2019/05/05","PMC6571860","","10.3390/metabo9050088"
